Name,Address,Longitude,Latitude,id,Qualification
Above Global Cleaning Service,"HEAD OFFICE : 4 IBIDO STREET, OKE - KOTO, TOTAL CAPITOL ROAD, AGEGE, LAGOS NIGERIA, Lagos, Lagos, Lagos",3.32359433174133,6.61548757553101,0ab91765-783c-4e79-9eab-fe9576d9c82d,5
Izode Laundry and dry cleaning services.,"1A Olubisi street off bishop hughes street, Ogba, Iju Ishaga Rd, Ifako-Ijaiye 100215, Lagos, Nigeria, Lagos, Lagos State",3.33404350280762,6.63899040222168,16661d70-ff2a-4afe-ba1c-741acf416dfa,10
COZIKS LAUNDRY AND DRY CLEANING SERVICES LIMITED,"No. 82 Yaya Abatan Street, Ogba, Lagos",3.336665391922,6.63602447509766,84c46615-4201-4f82-b218-11f1666a2895,1
Laundry and Dry Cleaning Consultant,"No 5 salvation street, Opebi Road, Ikeja Lagos, Lagos",3.3632071018219,6.59471797943115,5928cbda-60a6-4b87-b991-24a66910154d,6
PUREX KRYSTAL DRY CLEANING SERVICES,"17 B Abeokuta Street, Agege, Lagos",3.33137822151184,6.62210893630981,e4500089-332b-454f-b75d-493d0cb2aafb,2
JONATHANA A UNIQUE DRY CLEANING AND LAUNDRY SERVICES,"15 Ifelodun Street, Ado, Ekiti",3.33304166793823,6.61934423446655,15ef36f1-d81e-49cc-a290-25403f68242b,8
DECENTLY WEAR CLOTHING /DRY CLEANING HOME,"12 College-Road, Iju, Ondo",3.33437895774841,6.64397716522217,d1fd7570-35bf-4c20-870e-41e49aea3f5c,5
Beazyhands Drycleaners,"Dopemu, Lagos, Lagos, Lagos",3.31288623809814,6.6241340637207,4ca52045-9ff3-4cd3-a1cb-155034015cc5,1
Kleen Culture Drycleaners,"133,Iju Road, Lagos, Ogun",3.32317209243774,6.65033102035523,c8b5e61c-1afe-43ca-a84a-c42632fe94aa,5
Visadam Laundry and Dry Cleaning,"Diya Street, Lagos, Lagos",3.39163494110107,6.55226516723633,0afca021-2111-4925-8771-3085ce02478b,5
Spincity Dry Cleaners & Launderers,"48 Akerele St, Surulere 101241, Lagos, Nigeria, Lagos, Lagos State",3.40541291236877,6.548903465271,90fd669f-8397-4feb-8fce-f4e4d5310564,3
THE LAUNDRYMANN,"18 Akabueze St, Eti-Osa 106104, Lagos, Nigeria, Lagos, Lagos State",3.40559816360474,6.55188751220703,587477f3-46e6-4661-9f7d-cf09d5f45172,7
Pat Dry - Cleaning & Laundry Service & Barbing Saloon,"Ketu, Alapere, 35 Kazeem St, Kosofe, Lagos, Nigeria, Lagos, Lagos State",3.39681148529053,6.58812570571899,e9b7b1ce-bc76-476d-9ba4-5d18ac0af308,10
Clean Clutter Laundromat Drycleaning,"Agbaje, Lagos, Lagos",3.39379096031189,6.59350490570068,c65e046e-2650-45de-bfe3-397e84a06bbf,7
Clean Rite Dry Cleaning & Laundry Services,"Tiamiyu Olushile St, Kosofe 105102, Lagos, Nigeria, Lagos, Lagos State",3.37273406982422,6.56955909729004,afa16880-b32e-4008-8baf-afc270fedbc9,2
Topwash Home,"Akerele Street, Lagos, Lagos State",3.40533471107483,6.55036687850952,5d13ad67-88fa-4e3d-bcaf-3b008f2665a5,1
MasterCare Laundry & Drycleaning,"95, Ogudu Road, Ogudu, Lagos,23401, Lagos, Lagos",3.38496923446655,6.58158779144287,07eafdca-20e6-4334-a1f2-b8add861b8f2,2
Clean Ace,"Ogudu Road 149, Lagos, Lagos State 100242",3.39334583282471,6.57443714141846,dc9eaaa9-dd1f-426d-b777-7d237dc4dbe7,10
WQ Dry Cleaning,"40 Diya St, Gbagada 100242, Lagos, Nigeria, Lagos, Lagos State",3.38879060745239,6.55537080764771,eb281776-1706-4e85-91cd-18c8c986d6d2,6
Clean Care Dry Cleaners,"Okesuna Busstop, 17 Oluwalogbon St, Somolu 102216, Lagos, Nigeria, Lagos, Lagos State",3.37802410125732,6.53572750091553,68143b69-853b-4b70-bbc4-10478f50356a,6
Clothesline drycleaners,"9 akanni sowunmi st. mafoluku, Lagos, Lagos State 234",3.38321328163147,6.53854608535767,80a9aaef-8df6-4a8b-a2de-daa9d2cb4925,2
WhiteIce Laundry and dry cleaning,"1 Thomas Laniyan St, Anthony 105102, Lagos, Nigeria, Lagos, Lagos State",3.36839056015015,6.56369352340698,fc222d8f-243d-400a-b50c-937ed0e18523,6
LAUNDROBOT LAUNDRY AND DRY CLEANING SERVICES,"Cmd Road, Shangisha",3.38705587387085,6.59881687164307,b028b62f-a382-4b84-9c78-f8da208bfdb5,4
Citylight Dry Cleaners,"14 Bode Thomas St, Surulere, Lagos 101241, Lagos, Nigeria, Lagos, Lagos State",3.38374876976013,6.5352053642273,63c20812-ae34-446f-8417-e6f1f90f17e8,9
AMAZING LAUNDRY AND DRY CLEANING SERVICES,"Sovs Plaza Adewale Street, Adewale, Lagos",3.38379454612732,6.54126882553101,8888f465-9c1f-4acc-a588-44c1d217041a,10
Doctor Laundry and Dry Cleaning service,"15,Obanikoro Street Lagos., Lagos,01, Lagos, Lagos",3.37653207778931,6.53514337539673,c55a6238-21e6-4a99-90ea-4444bae5045f,5
Teeflourish Laundry and Dry Cleanining Services,"1,Wahab Odewale drive, Baruwa Inside, Ipaja, Lagos, Lagos,234, Lagos, Lagos",3.39469504356384,6.53149175643921,ef511f5e-dc04-4cd7-bf51-e41bf6f1d85f,7
Dryclean4u,"91, St Finbarrs Road, Akoka, Lagos, Lagos, Lagos",3.38598203659058,6.52280616760254,8eabb031-6a28-4da1-818c-43c820188fe7,1
PYRAMID LAUNDRY & DRY CLEANING SERVICES,"17 ANUOLUWAPO STREET ORILOWO, Ejigbo, Lagos 100264, Nigeria, Lagos, Lagos State",3.37698340415955,6.53089475631714,056b3675-d914-4659-92f7-3448999c9081,8
"Skywhite Drycleaners, Laundry and Cleaning Services","2 Ogabi Street, Abule Ijesha Rd, Yaba 100001, Lagos, Nigeria, Lagos, Lagos State",3.37867522239685,6.52351760864258,bbbd1020-4586-4fc3-86ad-43c5ab5c53b4,2
FastWash Laundromat,"12, Abudu street, off University Rd, Yaba 101241, Lagos, Nigeria, Lagos, Lagos State",3.38982605934143,6.51828622817993,1ef1e86c-5460-49c9-b6a2-ab0889e2c1c7,10
A & I Laundry & Drycleaning Limited,"228, Herbert Maculay Way, Lagos",3.37834692001343,6.50898838043213,11166bf9-c64f-42a7-af7d-12bd2518e929,9
Paragon Drycleaners,"91, St Finbars College Rd, Akoka, Yaba, Lagos, Nigeria, Lagos, Lagos State",3.38451600074768,6.52263116836548,8ad799c4-3ba8-449e-8bee-4b32d05c761b,7
Joyclean Laundry and Dry Cleaning Services,"10 Tayo Bello Ave, Agric 104101, Ikorodu, Nigeria, Lagos, Lagos State",3.36953949928284,6.52115345001221,cc7fb9f4-5255-4e41-b77e-3daba42cf5b9,9
HAWLEY'S LAUNDRY AND DRY CLEANING SERVICES,"Joseph Harrison Street, Onike, Lagos",3.3881311416626,6.50444316864014,fc4f607d-407d-4668-abf0-115c35520db9,9
Pillar's Drycleaners Services,"6 ADEBISI AWOSHOGA STREET,OPP. ONIWAYA HIGH SCHOOL, CEMENT BUS STOP CEMENT, AGEGE, Agege,1, Lagos, Ogun",3.38141942024231,6.5006422996521,00f805c8-58d9-4828-94c2-99d89c95016b,8
SHINE WASH DRY CLEANER'S ENTERPRISES,"Asubiaro Street, LAGOS, Lagos",3.37558674812317,6.52705430984497,cb43ca8d-036a-4f19-9a04-9b4c71a71c70,7
Lynx Laundromat,"37 Iwaya Rd, Iwaya 100213, Lagos, Nigeria, Lagos, Lagos State",3.38921737670898,6.50169277191162,94dc66f5-fcfc-4ed4-984e-1a19dea5dc0b,1
Aduragbemi international dry cleaning.,"Private Address in Lagos, Lagos State",3.38382530212402,6.48803377151489,15860237-488a-47c7-8df0-ea484ff1f489,7
H & M LAUNDRY & DRY-CLEANING SERVICES,"Mojoyinola St, Bariga 100242, Lagos, Nigeria, Lagos, Lagos State",3.38848400115967,6.49014616012573,6c329e0e-5c6e-4eb7-a8a9-0275e084b6b6,5
Snowyclean Laundromat,"31 Rd, Festac Town 102102, Lagos, Nigeria, Lagos, Lagos State",3.36704397201538,6.50901746749878,788cffd4-3a31-406c-af9a-f8ac4ce8af47,6
MIGHTY ADENUGA LAUNDRY & DRY CLEANING SERVICES,"Market Street, Shomolu, Lagos",3.37489700317383,6.53374624252319,6a00b15a-3feb-4b1f-a3a3-0e57822311c5,9
TEXTILE REVIVE LAUNDRY & DRY-CLEANING SERVICES,"44 Bajulaye Road, Shomolu, Lagos",3.37215828895569,6.5251898765564,2b3c1df5-1868-499c-8e87-6b90e82ebe40,8
Wasobia cleaning services,"68 wharf road ikorodu ikorodu, 306 Borno Way, Alagomeji-Yaba, Lagos, Nigeria, Lagos, Lagos State",3.37575912475586,6.5020866394043,1abae83b-14d3-41ac-b59e-8f18af1f2e78,5
Clothexpert laundry and drycleaning services,"109 Awolowo Rd, Ikoyi 101233, Lagos, Nigeria, Lagos, Lagos State",3.37231183052063,6.49541711807251,7ea19f3c-4a93-4376-b72d-9817d1099793,6
WHITE MAGIKWASH LAUNDRY,"23 barikisu iyede, onike, Yaba 101212, Lagos, Nigeria, Lagos, Lagos State",3.36834287643433,6.51112699508667,14bfca6f-f80d-4d37-bc96-787cd179eab8,7
Clean Rite,"14 Lanre Awolokun St, Bariga 102216, Lagos, Nigeria, Lagos, Lagos State",3.38311719894409,6.54733991622925,2f22e805-214f-4300-9064-0054d7253e67,10
Seal Dry Cleaner,"Shipeolu Street, Lagos, Lagos",3.36847996711731,6.53625202178955,1d78b5fd-d33d-4ad2-8d46-e69ac0cd40cd,6
Stylish laundromat ltd,"Plot 2120 Akin Mateola St, Amuwo Odofin Estate 102102, Lagos, Nigeria, Lagos, Lagos State",3.38310813903809,6.48774814605713,7c957005-7dfa-43dd-9f1c-153f6973cc7b,2
Changers Dry Cleaners,"261 muritala mohamed way alagomeji yaba, Yaba 100001, Lagos, Nigeria, Lagos, Lagos State",3.3817834854126,6.49078226089478,94f1016f-789b-40e6-b47f-0851476389dd,5
Kleenwash laundry and Dry cleaning,"30 Iletunmi St, behind Stadium Hotel, Surulere, Lagos 101241, Lagos, Nigeria, Lagos, Lagos State",3.36596584320068,6.50269937515259,64dad868-ae6c-4d07-a9e6-b65d076e2afd,10
Markleen Dry Cleaners & Launderers,"9 Ishaga Rd, Surulere 101241, Lagos, Nigeria, Lagos, Lagos State",3.35794734954834,6.51345109939575,701f54dd-8f39-465b-82df-0dfccd965948,6
Topiyke laundry,"local government, 9B Badaru St, Eti-Osa 106104, Lagos, Nigeria, Lagos, Lagos State",3.34977960586548,6.50511932373047,5c4a1251-5cfa-4065-a017-db784d486b95,4
Maven Clean,"62 Ahmadu Bello Rd, Ebute Metta 101245, Lagos, Nigeria, Lagos, Lagos State",3.37299180030823,6.49139261245728,9337d9ec-1816-4a0e-bf76-72b209b6d0b1,9
Spincity Drycleaners,"Akerele Road, Lagos, Lagos State",3.3550329208374,6.50507402420044,ffa24db3-70fa-439d-8c35-7b7fda659cd1,6
Perfect Wash Dry Cleaning and Laundry Services,"#38 Jebba St, Ebute Metta 900001, Lagos, Nigeria, Lagos, Lagos State",3.38741517066956,6.48546314239502,84eac05d-7d58-41d7-915c-9bbce861718c,10
CLEAN ANGELS DRY CLEANING,"10 Bola Shadipe Street, Bola",3.38867402076721,6.48159837722778,72784e10-ef56-407c-a52a-32ea518289ca,3
Mega Wash Dry Cleaning,"Adeniran Ogunsanya Street, Lagos, Lagos",3.35757303237915,6.49489688873291,01b49863-12e9-4d46-9b81-6bb4f53d2216,2
MeeCare,"42 Falolu Rd, Surulere 100001, Lagos, Nigeria, Lagos, Lagos State",3.35411977767944,6.50874757766724,2e3e7fc7-3080-44bf-bfc6-ba63f04fe0e0,3
Tbs Laundry Services,"House 7 Adedeji Street, Itire,, Suru Lere, Lagos, Lagos",3.33487987518311,6.5093846321106,5e88439a-1ade-4996-bf0e-69b059a25d74,8
"TheWash Depot Laundromat, Laundry & Dry Cleaning","17b Imam Dauda Street, Off Eric Moore Rd, Surulere, Lagos, Nigeria, Lagos, Lagos State",3.35102438926697,6.48188638687134,62dd3135-45c3-4a45-8a46-f3f347875530,1
HALAMCY DRY CLEANERS,"No. 17 Bal Ogun Alanamu Street, Ilorin, Kwara",3.36113929748535,6.49417448043823,e81a83d1-ca60-4370-9065-3f8b624efdbc,2
ADROLLY LAUNDRY AND DRY CLEANING SERVICES,"Aiyetoro Street, Aiyetoro, Lagos",3.34415888786316,6.49218702316284,1df9d311-1264-4880-bdf9-87e31cbdf840,10
Happy Smart Drycleaning & Laundry Services,"11, Bode Thomas Street, Off Johnson Bus Stop Surulere Local Government Surulere, Bode Thomas St, Alaka 100001, Lagos, Nigeria, Lagos, Lagos State",3.35929584503174,6.48895835876465,03d3457e-8759-4e51-a29e-2b9449cddb2b,5
Playright Laundromat,"14,ilorin street surulere lagos, Lagos, Lagos State +23401",3.34914445877075,6.49619340896606,c7b3ef7e-3f45-4f17-bd6c-9cc1dd6f6239,7
The Laundry Box,"19 Bode Thomas St, Surulere, Lagos, Nigeria, Lagos, Lagos State",3.34962010383606,6.48888111114502,5535ba85-0374-4c2f-8fb4-64540b64a227,4
LAVIDA'S WASH LAUNDRY AND DRY CLEANING SERVICES,"30 Karimu Street, Ojuelegba, Lagos",3.35936427116394,6.50781011581421,d68e4419-61db-485c-b68f-b9a5ba014bfa,3
Dry Cleaning Supplies Nigeria,"By Zenith Bank, No 23 Lawanson Rd, Surulere 101241, Lagos, Nigeria, Lagos, Lagos State",3.35091876983643,6.5127215385437,c6f76572-7768-45c2-9554-5d6b10ee27a5,3
Wq Dry Cleaning,"33,Ire Akari Estate Road, Lagos, Lagos",3.32225894927979,6.5257511138916,8b24f88a-6c5d-4b9b-9f36-06a2f1d95b5f,7
Omega Wash (dry-Cleaning and Laundry Services),"4, Okeho Street off Ire-Akari Estate Road, Isolo, Lagos,234, Lagos, Lagos",3.32696485519409,6.52754831314087,25e5fd6f-aa85-4511-9a83-6d1dadab6dd3,5
Laundry and dry cleaning services,"12 Panada St, Isolo 102214, Lagos, Nigeria, Lagos, Lagos State",3.32171010971069,6.52928781509399,5502f000-9653-4ccc-a3b7-3747df0bb7f8,10
G & A Dry Cleaning Services,"Igbo Efon, Lekki, 8 Baale St, Lekki, Nigeria, Lagos, Lagos State",3.32475757598877,6.52651929855347,b728b2c1-91da-458f-a8c2-675d24684af7,9
JCLEAN LAUNDRY&DRY CLEANING SERVICE,"Agility Estate Mile 12, Aina Road, Ketu",3.32280278205872,6.526526927948,5214c340-6e5d-4519-aa7c-c5a1b75b2e07,9
GUSTAVO LAUNDRY & DRY CLEANING SERVICES,"Okanlawon Street, Mafoluku",3.31852006912231,6.51150512695313,49f4939d-612e-4346-9dce-c447a4cede7a,8
ANU-OLUWAPO LAUNDRY AND DRY CLEANING,"10 Olufinmilayo Agboola Street, Tanke",3.3248016834259,6.51188802719116,afcf7e15-6b9c-46de-9189-68874f3ce534,2
Clean Image Laundry Service,"Kolawole Shonibare St, Isolo 102214, Lagos, Nigeria, Lagos, Lagos State",3.32652521133423,6.54560136795044,9a76196d-29a8-4021-baa1-62bed72e45bf,7
Embassy Laundry And Dry Cleaning Services,"121 Okota Rd, opp. UBA Plc, Ilasamaja 100263, Lagos, Nigeria, Lagos, Lagos State +234",3.32205104827881,6.51077699661255,e41d2d42-2718-4fdc-ab8d-36a479ae45a1,1
Laundry Hub,"Peter Agha St, Isolo 102214, Lagos, Nigeria, Lagos, Lagos State",3.31698536872864,6.53487682342529,3d1589e6-dc7e-4bcb-8b03-e522ca220d84,2
Royal Dry cleaning services,"2 Joel dunmade Street, Off Adefimihan St, Surulere 103251, Lagos, Nigeria, Lagos, Lagos State +234",3.34017205238342,6.51560878753662,020e8580-7aa2-4af3-b752-c29a0e82c469,6
Hephzibah Laundry Services,"Off Lawanson Road, 55 Abayomi St, Surulere, Lagos, Nigeria, Lagos, Lagos State",3.34305691719055,6.51172876358032,9749d649-d071-41cd-ba6d-1552d554e5e0,5
CleanAce Drycleaners & Launderers,"Plot 130, Amuwo Odofin, Festac Access Rd, Festac Town, Lagos, Nigeria, Lagos, Lagos State",3.30313229560852,6.48541879653931,6e3d4bea-8195-4d2b-a7f6-b4628b122379,7
HB SERVICES- LAUNDRY & DRY CLEANING,"72 Kajola Road, Obawole, Lagos",3.36286187171936,6.46886873245239,23088cfc-8e91-44ba-a2a0-ef5b4919cdcd,4
GHC Drycleaners,"103 Muyibi street, Olodi Apapa, Lagos., Lagos, Lagos, Lagos",3.33876156806946,6.44834995269775,9b5309cc-21ed-42cc-a60d-691fd0a8c14c,5
Egc Dry Cleaners,"7,Adele Road, Lagos, Lagos",3.36994504928589,6.44053411483765,f3af8bcf-146e-4d1f-9624-55b773419dbd,10
F & M ADROIT LAUNDRY AND DRYING CLEANING,"Megba Street, LAGOS, Lagos",3.33489942550659,6.45531892776489,8d2258e8-d720-4325-a87b-060380e47eda,5
CLEAN OUTFIT LAUNDRY AND DRY CLEANING SERVICES,"46 Sanusi Street, Sanusi",3.34565091133118,6.47695255279541,f47f0601-7bce-4cc0-be5a-5eefb7c8e8f3,2
Weezley Classic Barbing Saloon and Dry-Cleaning Services.,"Head Office: No 2 Okanlami Oguntola Street Inside Agbele Grammer Skool After Baba Olomi House Ikorodu Lagos, Branch Office: No 3 Poro Imope Village cele bus-stop Along Ijede Road Ikorodu Lagos., Lagos, Nigeria Ikorodu, Lagos, Lagos",3.39582991600037,6.45306015014648,6cac467f-b803-4f7c-951e-68795f46eb8f,10
Excelsior Laundry & Property Solution Services,"3, Gov. Raji Fashola road, Diversion bus-stop, Odogbonle-Noforija, Eredo-Epe, Lagos state",3.39879941940308,6.4558310508728,ead28dc6-2c5b-41d2-8afd-bb9dcd03dcbe,1
WASH A WASH Laundry Service,"29, Beecroft Street, Lagos - Island, Lagos,234, Lagos, Lagos",3.40093874931335,6.45251131057739,7d16730d-70d6-4eab-8e23-43797f99f994,6
GROSSVENOR LAUNDRY AND DRY CLEANERS,"18 Ajibade Street, Ibadan, Oyo",3.39582920074463,6.45300769805908,3e4c4350-785e-4d5f-ba9f-4c222cb7d800,10
Scott Laundry & Dry Cleaning Service,"Peace Estate, House 40,4th Avenue, Nosiru Baruwa Cl, Ipaja 100278, Lagos, Nigeria, Lagos, Lagos State",3.44621324539185,6.4672064781189,abf25574-1f34-483b-a7c6-d12234410058,4
CleanAce Drycleaners & Launderers,"15 Wole Olateju Cres, Lekki Phase 1 106104, Lagos, Nigeria, Lagos, Lagos State",3.45747900009155,6.44827079772949,f17253fa-ffee-408f-abfe-6f6ef64c942c,1
Alpha Laundry and Dry Cleaners,"11a Wole Ariyo Street, Off Admiralty Way, Lekki Phase 1, Lagos, Nigeria, Lagos, Lagos State",3.45878839492798,6.44203948974609,656a499a-b6d0-411f-91ad-e98e0d5b6d10,9
Astra Cleaners LTD,"29 Fola Osibo Rd, Lekki Phase I 105102, Lekki, Lagos, Nigeria, Lagos, Lagos State",3.46783900260925,6.44264316558838,ec2ee8f5-9425-48a3-9aa8-a8f687c3ffc3,1
C&I Laundry and Dry Cleaning,"39 Onikoyi Rd, Ikoyi 101233, Lagos, Nigeria, Lagos, Lagos State",3.44768905639648,6.45580720901489,8ce037e5-25e3-446d-8246-bb4c2ad5fb0a,4
Garment Care,"Otunba Adedoyin Ogungbe Street, Lagos, Lagos",3.45737099647522,6.43494701385498,1809cf22-c920-4a0b-b2da-b966a88cd015,6
Skip Your Laundry,"17J Admiral Ayinla Way, Freedom Way, Lekki Phase 1, Lagos, Nigeria, Lagos, Lagos State 101222",3.4814727306366,6.44103002548218,53ea3f59-1773-4a56-ae17-c0984a204ccb,8
Kendux Laundry and Dry Cleaning Service,"44 Ikate Elegushi Rd, Ikate Elegushi, Lekki 101245, Lagos, Nigeria, Lagos, Lagos State",3.48587107658386,6.43361139297485,c3689e04-a38b-4af5-82db-68184518877b,9
RockWater DryCleaning + Laundromat,"37b Freedom Way, Lekki Phase 1, Lagos, Nigeria, Lagos, Lagos State",3.48166060447693,6.43741178512573,b1e00088-f0c0-45d6-bfa7-dabb151438a9,2
PREMIER LAUNDRY AND DRY CLEANING SERVICES,"Westend Estate 2A House 42, Road 4, Lekki Country Homes, Lekki",3.47633099555969,6.45040225982666,f61db796-b533-428e-9a9d-645408a1e205,1
WASHSPOT LAUNDRY AND DRY CLEANING,"House 8 Rosbank Court, Lekki, Lagos",3.46880030632019,6.43109798431397,85b87aff-1c61-404c-95ca-74f085df391b,3
Satorialé Leisure and Tourism Limited,"31 Admiralty Way, Lekki Phase 1 106104, Lagos, Nigeria, Lagos, Lagos State",3.45593643188477,6.43687582015991,3034720a-d066-4a52-9b85-aacc0ab87af3,6
Snowflakes Drycleaners,"Ajose Adeogun St, Victoria Island, Lagos 106104, Lagos, Nigeria, Lagos, Lagos State",3.4343855381012,6.43067407608032,093ce6c1-8113-4af9-b2b2-c6da7be5ffa1,9
Dryclean4U Limited,"28B Admiralty Wy, Lekki Phase 1, Lekki 106104, Lagos, Nigeria, Lagos, Lagos State",3.48063039779663,6.44790458679199,f67d056e-904e-4b61-ad30-88d853d4205d,5
B&T Laundry Dry Cleaning,"5-13 Adeola Odusanya Cl, Alagbado 102213, Lagos, Nigeria, Lagos, Lagos State",3.41997385025024,6.4327883720398,13770490-3d8b-4ba8-9587-9f52c1fbe2b8,5
Laundry48 Laundromat,"Sunmart Mall, 1 Meadow Hall Way, Eti-Osa 101222, Lekki, Nigeria, Lagos, Lagos State",3.48858380317688,6.43072414398193,8e411d06-f2a7-435e-bd7e-dfe84e88ba43,10
Periti,"26 Karimu Kotun Street, Lagos, Lagos State",3.42561149597168,6.43040323257446,b373e645-65f6-4471-ac50-08573a209a24,6
"Garment Care Limited - Dominion Plaza, Lekki","Level 1, Suite 1B, Igbo-Efon Bus Stop, Dominion Plaza, Along Lekki - Epe Expy, Maroko 106104, Lagos, Nigeria, Lagos, Lagos State",3.45700192451477,6.43462896347046,3faf9d89-4372-49dc-96c9-5632d0f2fb45,2
Laundry DNA,"28, Kusenla Road, Ikate Elegushi Water Front Road, 4th Roundabout, Lekki., Lagos,23401, Lagos, Lagos",3.49077796936035,6.43894910812378,ac1209f9-03de-42e0-b51d-0ff3b9a78aa1,2
The Washroom Laundry & Dry Cleaning,"Km 11 Lekki - Epe Expy, Ikate-Elegushi 105102, Lekki, Lagos, Nigeria, Lagos, Lagos State",3.49238586425781,6.43434858322144,4cb9ab2b-a82d-4c62-bfe2-83face32c749,10
PAYLESS LAUNDRY & DRY CLEANING SERVICES LTD,"No. 1 Lekki Phase 1, Lekki, Lagos",3.49946880340576,6.43445539474487,b7679f23-92aa-40e4-92af-d80f3187fe18,2
Laundry Direct Drycleaners,"2 Ganiu Eletu Way Osapa London Behinde Shoprite Lekki, Lagos, Nigeria, Lagos, Lagos State",3.50966691970825,6.43849182128906,617d4922-00a1-4ff1-8cfb-97f7fd9be24e,8
Alpha Laundry and Dry Cleaners,"No 6 Nonso-Chukwucheben Street, Atlantic View Estate, Alpha Beach, Igbon Efon Chevron, Lekki Lagos, Nigeria, Lagos, Lagos State",3.52190256118774,6.42539834976196,3e05acdb-fabd-4d18-bf82-3844e7daec88,5
MAGICWASH LAUNDRY,"3 aro ologolo road Lekki, Eti-Osa, Lagos 105102, Lagos, Nigeria, Lagos, Lagos State",3.5160973072052,6.43171834945679,9b136af4-f599-4e14-8bf0-37a56ecaea6d,6
Sapphire Laundry,"28 Agungi Ajiran Rd, Lekki Penninsula II 106104, Lekki, Nigeria, Lagos, Lagos State",3.51646852493286,6.44418239593506,65b1af14-817d-4bc2-aeb2-e6b03bf3a886,1
KENDUX LAUNDRY & DRY CLEANING SERVICES,"Road 26 , Ikota Villa Estate, Lekki, Lagos",3.55618000030518,6.44991779327393,d7260b37-b39e-42ce-b48c-509988cee7d5,4
Laundry House Company Limited,"Goldcrest Plaza km 14, Lekki-Epe Expressway, Ajah Lagos, Lagos",3.54093027114868,6.44245958328247,9038e08e-daf5-4fad-addd-83a3e9cdadce,7
Richfred Laundry Care & Drycleaning Services,"Road 2, 34b ikota villa estate, Lekki - Epe Expy, beside the Mega, 105102, Lekki, Nigeria, Lagos, Lagos State",3.55296754837036,6.45043992996216,aeba3923-5123-46f4-8be6-215ecb3e5ab3,10
HNI Laundry and Dry-cleaning Services,"Lagos, Lagos, Ogun",3.57540011405945,6.48450994491577,a6d9d6e9-95fa-4a40-9f29-f962224e0b86,5
U-Wash Laundromat,"Ajah-Lekki Expressway, Lagos Nigeria, Lagos, Lagos, Lagos",3.57112574577332,6.46901845932007,1f4505ae-737c-4983-9410-e56a79b73206,1
Laundry Lord Dry Cleaners,"No 14 abioye akano close off asajon street sangotedo, Lekki - Epe Expy, 100242, Eti osa, Nigeria, Sangotedo, Lagos State",3.62104392051697,6.47436141967773,4c098c5b-1bcb-408c-914b-5f273914e986,4
Laundroshack,"Enyo filling station, No 2 Addo Rd, Aja 106104, Lagos, Nigeria, Lagos, Lagos State",3.57825326919556,6.48722124099731,8637f4a3-0478-4410-bcd4-455327ae4dab,8
Neignbournood Washman Dry Cleaners,"4 Eti Osa Shopping Complex Victory Estate Bus Stop, Langbasa Rd, opp. Catholic Church, Aja, Lagos, Nigeria, Lagos, Lagos State",3.58957457542419,6.50541210174561,14c59129-1bf4-4662-99e7-3377d919d2e3,9
PRESTIGE NEIGHBOURHOOD & DRY CLEANING SERVICES,"Lotto Shopping Mall Lekki -Epe Expressway, Epe, Lagos",3.65723562240601,6.46745109558106,18c3437c-4688-4e84-b7bc-453c857c6a38,5
Habobo's Launderette and drycleaing services,"88, Obafemi Awolowo way, Bayeku road, Igbogbo Igbogbo/Bayeku, 104102, Ikorodu, Nigeria, Igbogbo, Lagos State",3.52346777915955,6.58553266525269,916a4852-d30b-4312-852f-abf397643b9b,6
Digital World,"27 Ikorodu Rd, Ikorodu, Lagos State",3.50252318382263,6.63067817687988,389086cf-8d31-46b8-9904-98210f61a5c3,5
Washaman drycleaners,"20a Sinari Daranijo St, Victoria Island 106104, Lagos, Nigeria, Lagos, Lagos State",3.43152189254761,6.4283652305603,82acf916-0c86-4e15-9d92-5bbde6a9bc53,5
Nathans Superior Dry-Cleaning & Laundry,"56 Adetokunbo Ademola Street, Victoria Island, Lagos,101241, Lagos, Lagos",3.430668592453,6.43194627761841,5c16fab1-9e08-460e-b5e6-20f6efef0fe5,8
KENIMA LAUNDRY AND DRY CLEANING SERVICE LTD,"White House Amusa Alalapa Street, Amusa, Lagos",3.50179028511047,6.62100648880005,d15d3839-fb9b-49ba-bc12-2d3f9751a4a5,9
So Clean laundary and dry cleaning services,"Ladeinde,Igbe, 10 Faith Ave, Igbogbo 104101, Ikorodu, Lagos, Nigeria, Asese, Ogun State",3.41441702842712,6.77606916427612,a4f0396d-e4da-4542-adaf-398deba9ce58,4
Cleanace DryCleaners,"Shopping Strip on Ikeja Way, Off Badagry St, Dolphin Estate 101222, Ikoyi, Lagos, Nigeria, Lagos, Lagos State",3.36107325553894,6.57844114303589,be5148e5-0c73-477f-bdea-5514cb703b69,7
BEST CLOTHES CARE LAUNDRY AND DRY CLEANING SERVICES,"Ogunlana Street, Egbeda, Lagos",3.3846447467804,6.60209608078003,66612728-9511-465e-b3e1-524fe3c96c4b,7
Joyclean Laundry Service,"19 Aladelola Street, Ikosi Ketu 105102, Lagos, Nigeria, Lagos, Lagos State",3.38054966926575,6.60372352600098,0253a91c-ebbf-4307-9e0e-92576db49a42,8
Laundry Box,"90A, Opebi Road, Opebi, Ikeja, Lagos",3.35662031173706,6.59458255767822,8ec8cf82-7185-42e5-8a91-2be1edbcc755,8
Sharonklean Dry Cleaners Limited,"No. 4, Ayinde sanni street, off Oregun, Kudirat Abiola Way, Oregun, Ikeja, Nigeria, Lagos, Lagos State",3.36342096328735,6.60181903839111,ac3a182f-e410-4439-806c-7b195b79e643,10
SE Cleaners,"Igbosere Road, Lagos, Lagos State",3.40458369255066,6.44920635223389,b5f715ac-6d1e-4d7b-90af-d732c4825dab,9
Abundance Drycleaners Limited,"19 Keffi St, Ikoyi 106104, Lagos, Nigeria, Lagos, Lagos State 102241",3.41504001617432,6.44911479949951,f3a61d7b-0b3d-4842-add1-55be309126a1,4
DESMOND-TITTO LIMITED,"Shop 8 Olosun Shoping Complex, Gerewu Road, Off Yebumot Round About, Adewole Estate, Ikotun,0234, Lagos, Lagos",3.40458750724793,6.45481729507446,43f5d378-fc30-4f1f-af0d-38bd9e664420,7
KAZEEM TEMIDIRE AUTO MECHANIC,"Babs Animashaun Road, LAGOS, Lagos",3.34856700897217,6.48258876800537,97316e9f-7a63-4b73-8818-547d721be9fb,5
Janet Mechanic Workshop,"5 Thomas St, Ebute Metta 101245, Lagos, Nigeria, Oyingbo, Lagos State",3.39582920074463,6.45300769805908,4e4c2612-d130-4efe-b53d-1cdee3ddbcec,8
OLASUNKANMI AUTO- MECHANIC WORKSHOP,"Abayomi Street, Lawanson, Lagos",3.34709644317627,6.50755596160889,a250297a-63ae-4243-be0f-7dffd2eff91d,7
Motor mechanic,"91, Ajegunle, Lagos, Nigeria, Lagos, Lagos State",3.3497006893158,6.51956939697266,ceb6d0b9-8926-4dc4-9527-7f5927bbd515,8
THE MECHANIC AUTO CARE,"Elyon Building Plot 85, Iju Ishaga Road, Ifako, Lagos",3.3562343120575,6.5144534111023,764174d6-bcaa-4e23-97e5-ecd9284b1da3,3
GANIYU YAKUB AUTO MECHANIC SHOP,"No. 27 Wright Street, Yaba, Lagos",3.38003063201904,6.49028587341309,c6727aa7-344b-45b0-9fa2-51fc2ceb01a1,1
Mosco Fixers-Automobile Mechanic,"5, Ayenuyo close iyana ejigbo Isolo, 100003, Lagos, Nigeria, Lagos, Lagos State",3.34244680404663,6.53106927871704,04568ec4-1ecd-4a07-a374-d8b730c02a22,6
ISMO AUTOMOBILE MOTOR MECHANIC ENGINEERING WORKS LTD,"Plot 19, Mechanic Village Jimoh Odutola Street, LAGOS, Lagos 101283",3.35542273521423,6.48057842254639,6d6d1edd-3a3d-4a77-aff4-4b75f07ce2ed,1
Usher auto mechanic ltd,"9:Christ avenue off power line road ikola ipaja command secodary school road barrack bus stop lagos., Lagos, Nigeria Post to usher auto mechanic ltd, Lagos, Lagos",3.39582920074463,6.45300769805908,8092bc4a-ad85-4750-9ff3-d2351af88a4c,4
Orilagbeke Auto Mobile Mechanic,"Phase 2, Off Shobukola, 1 Koleade St, Ikotun, Lagos, Nigeria, Lagos, Lagos State",3.38322424888611,6.55380296707153,fce18c6b-1ba5-4e34-a09c-d021f91eb92e,4
Goa Automobile Diagnosis | Automechanic | Mechanic in Lagos,"43 Oremeji St, Mushin 100254, Lagos, Nigeria, Lagos, Lagos State",3.36391687393188,6.55122900009155,024403c5-7f93-4f4a-b868-0a06d2327c84,1
MURAINA AUTO MECHANIC,"Oke Suna Street, LAGOS, Lagos",3.40459847450256,6.45091962814331,c61dac98-23a0-460a-9927-4d8e7328326e,1
