Name,Address,Longitude,Latitude,id,Qualification
REQUEST MECHANIC LTD,"13 Aderupoko Street, LAGOS, Lagos",3.39339733123779,6.50634431838989,62214992-24ad-4b97-8693-4649942114b1,9
Chibuike Volvo Mechanic in Lagos,"Ladipo Volvo Plaza, 15 Alh. Amusa St, Mushin 100254, Lagos, Nigeria, Mushin, Lagos State",3.34524035453796,6.53908586502075,6be79f1b-b22f-4432-a71a-d7a1e2635672,7
FARAK AUTOMOBILE MECHANIC,"Oregun Kosebinu Street, Oregun, Lagos",3.4285581111908,6.46281003952026,10c0d385-3efc-4ac7-93d7-0474bffcefb0,10
DANNYTEE MECHANIC ENGINEERING,"Adeniyi Street, Itire, Lagos",3.33427476882935,6.51528072357178,ec5534d4-405b-4c75-a941-b8cfbf78deab,9
Genais Auto Company..(Auto Mechanic Workshop),"54/56 Opebi Road, by Salvation Traffic Light, Opebi, Ikeja, Nigeria, Ikeja, Lagos State",3.3616259098053,6.58892440795898,0bf86c54-8e81-435c-85df-77c2b2dd9f90,7
RAJI-IDRIS AKINSOLA AUTO MECHANIC WORKS,"Murtala Muhammed Way, Murtala, Lagos",3.41977214813232,6.45222806930542,111582cf-0d91-43e1-8426-a3aa96ac79fa,2
Carmax Autocare Center,"Carmax Autocare Center, Plot A2 Billings Way, Lagos,23401, Lagos, Lagos",3.36855411529541,6.60255193710327,1d12226f-78c1-4327-9292-3a07d4a60b76,6
Hanzola Automobile Mechanic,"58 oremeji street ilasamaja mushin LAGOS nigeria, Lagos, Lagos, Lagos",3.34491491317749,6.53397512435913,b8714f0b-5d0d-4679-991b-9585c5cabc10,2
City Mechanic Service Center,"gate 2, ladipo oluwole street, off oba akran avenue,opp guinness, Nigeria, Ikeja, Lagos State",3.33570408821106,6.61465501785278,5a980ebf-8d74-4727-8a80-03ff0c6834ea,10
ROYAL GEM AUTO CARE NIGERIA LIMITED ( MECHANIC SERVICES ),"320 Ikorodu-Ososun Rd, Anthony 105102, Lagos, Nigeria, Lagos, Lagos State",3.36684918403626,6.56114435195923,a2a52c7b-a985-42cb-9d5b-7a83922afa40,8
KOLAPO AWE ELIAS MECHANIC SERVICES,"Kudirat Abiola Way, Oregun, Lagos",3.36506104469299,6.60007905960083,be7014cc-0e9e-49b2-bf18-83a56d1faf0c,4
Malo Auto Mechanic Workshop,"Orile Ilasan bus stop Beside World Oil Filling Station Oniru VI Lekki, Aja, Lagos, Nigeria, Lekki, Lagos State",3.49858617782593,6.43529176712036,b6ed0cb2-9ab8-4a8e-9f9e-3a4bbeab6f56,5
Lady Mechanic Initiative,"Lekki, Jakande Round About, 4 Lekki Beach Rd, Lagos, Nigeria, Lagos, Lagos State",3.50819611549377,6.43518114089966,515fc2b7-0ade-4cdf-9632-c5903ed4aa72,5
Lady Mechanic Initiative,"Abijo GRA, Commercial City, Lekki - Epe Expy, 106104, Lagos, Nigeria, Lagos, Lagos State",3.54370784759522,6.44651126861572,eccf1688-5fb0-40e0-9a92-b81ddeae1d38,4
Lady Mechanic Initiative,"4, Lekki Beach Road, Jakande Roundabout, Lekki",3.50798201560974,6.43629169464111,1d4312e4-3037-45ae-8278-6179f748d4d9,3
LONEWOLF MECHANICAL SERVICES,"Plot 5 , Lekki Epe Expressway, Km 49, Lekki, Lagos",3.51488280296326,6.43617391586304,bdd61fef-5d55-4474-91b9-8b4d46de8710,2
"MARCO AUTO SERVICES | Mercedes benz mechanic, Car tracking, Auto Elect & Mech Engrs, Bodywork & Painting, mercedes benz workshop, car diagnostic center, Mercedes Benz Diagnostic centre, Mercedes Benz Mechanics in Lagos, Lekki, VGC, Ikoyi, VI","KM 25 Lekki - Epe Expy, Aja 100001, Lagos, Nigeria, Lagos, Lagos State",3.5814642906189,6.46966552734375,3dc3daa4-6a10-4302-9683-2114971c35da,10
LADYBENZ AUTO MECHANIC LTD,"KM 41 Lekki Epe Express Way Abijo Gra, Lekki 105101",3.66790533065796,6.46555185317993,3edb87ab-9138-4e6c-a9f1-cf4778420aff,7
Mechanic On The Go | Auto Repair and Services,"Amara Olu St, Agidingbi 101233, Ikeja, Lagos, Nigeria, Lagos, Lagos State",3.35570669174194,6.62646245956421,bb25ebb7-3e4b-4458-ae4d-f2c25220584e,7
The Mechanic Place,"Ipaja Road, Lagos, Lagos State",3.31955218315125,6.62353420257568,23c135fa-759a-486e-bc55-4e2c8757d0bb,7
Ismaila’s Mechanic Workshop,"4 Oladiti Street, Onipanu, Lagos 102215, Lagos, Nigeria, Lagos, Lagos State",3.33864784240723,6.65351295471191,63ef9969-8b33-4912-ae7a-4e6e2f71cd36,2
Mechanic On the Go,"Ogba Road, Lagos, Lagos State",3.33411693572998,6.61767196655273,06df31d8-ab81-4fcd-a181-ca1cefe1520a,5
Bee Printing Mechanic Co.,"84 Bajulaiye Road, Lagos, Lagos",3.39109992980957,6.55913305282593,02352ab1-c4c6-4329-8e26-3e34823a1fe6,6
Deepwaters Offshore & Energy Consultants Limited,"Yad Prime Shopping Complex, 32, Addo Road, Ajah, Lekki-Ajah 105100",3.56783962249756,6.47476005554199,6022ea96-aa65-4bd8-b523-01923a601ae4,3
The Sex Mechanic,"MKO Abiola Crescent Ikeja, 100001, Lagos, Nigeria, Ikeja, Lagos State",3.35297250747681,6.59517288208008,e5c417d2-c4f2-4d5c-adc5-67448cc27419,7
AutoShop Limited,"Ivory Music House, IPM Avenue, Alausa. Ikeja, Lagos, Lagos State 23401",3.3548743724823,6.61573457717896,d4b20987-15bc-40e8-8f4c-53de7b8bba6e,2
ADE AUTO MECHANIC & SPARE PARTS DEALER,"Road B, Owode Ilesha Road Area, Zone 2, Adeleke, Osun",3.34249877929688,6.62450551986694,544470d6-2242-4b35-8471-fe451a49f359,2
BUKKY AUTOMOBILE MECHANIC NIGERIA ENTERPRISE,"Agagu Powerline, Power line",3.31674671173096,6.63449144363403,7d15fa81-d1a0-4afb-94a3-603e67ec385f,1
Adedoyin Motor Mechanical Works,"Mechanic Village, 1 Oba Ogunji Rd, Ijaiye 102212, Lagos, Nigeria, Lagos, Lagos State",3.33038973808289,6.62826776504517,2890e618-f11b-4b23-9276-2d3cd29571f5,7
Ibitoks Hospital,"Mechanic Village Road, Lagos, Ogun",3.29951596260071,6.63806295394898,81786b99-b0ca-4945-9905-d6edcc935761,7
Platinum Auto Spray And Oven Bake,"11b Oba Ogunji Mechanic Villa, Oba Ogunji Road, Ikeja,100218, Lagos, Ogun",3.32257676124573,6.62741327285767,c9bfe154-a8ec-408c-ab54-2facfa23f7a9,5
MY OGA MECHANIC DIGITAL PLATFORM,"Diamond Estate Road 16 A, Lasu Road, Lasu, Lagos",3.27593398094177,6.57707643508911,ebd9f463-b6bf-493e-8b37-6aa532dc66b7,8
JELILI AUTO SPECIALIST,"Plot 8 Mechanic Village, Ojota, LAGOS, Lagos",3.3757438659668,6.51541709899902,9015d4ec-e58d-486e-b3e5-994b7e171c17,7
Karokome Enterprises,"Local Government, 3 Amodu Tijani Cl, Victoria Island, Lagos 101251, Lagos, Nigeria, Lagos, Lagos State",3.42694973945618,6.4321780204773,f8154c02-6d11-41f2-9ac7-e4cebb04c9b7,5
Hydrogas Inspection Services LTD,"9 Calcutta Cres, Apapa Quays 102272, Lagos, Nigeria, Lagos, Lagos State",3.36539340019226,6.44043207168579,33df3891-4177-4de3-bfa7-896a9ae3c298,9
Ramon Welder,"Ijesha, Babatunde St, Lagos, Nigeria, Lagos, Lagos State",3.34002923965454,6.64096307754517,ca22f3ef-fa59-4489-a514-c1c48fcfea00,7
Femi Welder,"Lasu Bus Stop, Lagos - Badagry Lasu, Lagos, Nigeria, Lagos, Lagos State",3.27746915817261,6.57698059082031,a86cd56a-ea16-4cbe-9b09-13f3651ef3dd,5
Fela Aluminum and welding construction company,"170 Ipaja road Agege, LCDA 100001, Lagos, Nigeria, Agege, Lagos State",3.29775643348694,6.61406087875366,4402a422-aa0a-4797-ae48-1d649e02b2fa,7
GODS FAVIC WELDER,"66 Prince Ajibola Road, Ajibola, Ekiti",3.38304805755615,6.57070779800415,e4742327-f785-4665-831a-442dc8ece8b2,6
Oladeji Akanbi Welder Shop,"Ilasamaja, Oladosu Sanusi St, Lagos, Nigeria, Lagos, Lagos State",3.37630271911621,6.53197193145752,11bc25ad-6adf-4f3e-8efc-60ef307a22c5,9
professional welder,"Private Address in Lagos, Lagos",3.39580011367798,6.45310020446777,ad3f0e4b-cbe6-41de-80c6-5ad80208efdd,10
ASIKO WELDING CONSTRUCTION EKITI,"No. 1, Akeju Street, Oke Ila, Ekiti",3.37781524658203,6.54442119598389,8a15ef84-dbc7-4a51-a8db-cdf6c3bb68d1,7
Olumide Aluminum,"351 Ikotun - Idimu Road, Isheri Rd, Idimu, Lagos, Nigeria, Lagos, Lagos State",3.2741904258728,6.56259489059448,e8b683cd-27cf-4fa8-bebc-13b346e34a29,4
Abel Enterprise,"Oshodi, Agege Motor Rd, Lagos, Nigeria, Lagos, Lagos State",3.34731650352478,6.56645917892456,3b2a2e0f-972b-44f7-91fe-53a492ddf477,6
DONABLESS INVESTMENT COMPANY,"23 Agarawu Street Adeniji, LAGOS, Lagos",3.38919401168823,6.45767402648926,b978918e-2936-4541-8cdc-30544f76d439,9
MALEOH,"Suite C152, Ikota Shopping Complex, LAGOS",3.38527655601501,6.48870992660523,bc0d6b84-73e7-42e2-a99c-9058c1018822,10
SOLIHULLTZ ENERGIES LIMITED,"8 Davies Street, Lagos, Ogun",3.39695405960083,6.60088920593262,d798e36e-80fe-4390-bb52-82a701ca778a,6
DEEFORT ENT. INTER. LTD,"Ikeja Industrial Estate (Ogba Scheme), Lagos, Ogun 22506",3.36578011512756,6.60754919052124,61b9ed04-a3c2-4992-b768-bfc22d99134a,10
OJONLA CONSTRUCTION AND VENTURES,"21 Alhaji Bakare Street Ojodu Berger, Local, Ojodu 100001, Lagos, Nigeria, Lagos, Lagos State 100001",3.36808180809021,6.64109706878662,692b9813-5c9e-432a-93a5-2341e273348a,4
Manpreet Limited,"5 Sanusi Fafunwa Street, Lagos, Lagos State",3.42632007598877,6.42945671081543,f428f6f0-984f-4b72-a9de-65258c0f2b23,7
LES Energy Services,"Block 100 Furo Ezimora Street, LAGOS, Lagos",3.46629929542542,6.43283414840698,d7e40cec-dcf9-40d3-bf62-bbfd7af930c9,9
PEACE GLOBAL SERVICES,"Suite 3b Churub Mall Plaza Lekki- Epe Expressway, Lagos, Ogun",3.53309893608093,6.44217300415039,a351f8cf-49c3-4c6b-9451-8437dca50e83,1
TENAX ENERGY LIMITED,"Africa Lane, Lekki, Lagos",3.47370147705078,6.45653915405273,dd1a0b84-73c2-4e28-a1be-2b703f552b9e,1
OTUAZ TECHNOLOGIES NIG LTD,"5, Edafe Close, LAGOS, Lagos",3.6296079158783,6.47173309326172,97375d19-7eb2-4826-99d3-c7dec63c6e4e,1
ARO WELDER GLOBAL COMPANY LIMITED,"New Site Avenue, Ijebu Ode, Ogun",3.92089200019836,6.82080268859863,da1a9e56-7f4c-40e6-bb39-1b3c3c8afe53,6
"Opeloyeru furniture, carpenter and upholstery works","Oloje estate phase 2, beside Zulu block, Ilorin, Nigeria, Lagos, Lagos State +234",3.4232029914856,6.46008539199829,aa091d3c-65a3-4d02-8802-7fd777b44fd2,5
xilema veneer,"S. W, 1b LALUPON close, off Keffi St, Ikoyi 101233, Lagos, Nigeria, Lagos, Lagos State",3.41506433486938,6.44845104217529,1af66e28-3970-4822-b191-b67e4a4e8ec5,6
Woodpecker Concepts Ltd,"2 Owolewa Street, off Randle Ave, Surulere, Lagos, Nigeria, Lagos, Lagos State",3.35743689537048,6.51181554794312,349593c7-a3dc-4404-a64c-af2371716292,4
Naija Woodshop Limited - NWS,"Lagos Lagos NG, 4a Agunbiade Bankole St, 106104, Lekki, Nigeria, Lagos, Lagos State",3.38365006446838,6.45748710632324,f99306ea-4a03-471a-9fd7-70f96e81cde5,3
Surewoods Nigeria Limited,"Mushin Halt,100253, Lagos, Lagos",3.34539985656738,6.51917219161987,f922f78d-68a8-4eb4-b80a-5c0660612a27,6
RETROP LIMITED,"211 Herbert Macaulay Street, Lagos, Lagos",3.39528298377991,6.45356702804565,f6cd9b5d-117c-4739-97b1-6c04a99cb68b,1
C S L,"Apapa Dockyard Road, Lagos, Lagos",3.365149974823,6.45943880081177,b37955c6-4e95-4c46-a2ef-c62b330c5af7,3
Box And Barrel,"133B ETI OSA AVE DOLPHIN ESTATE IKOYI LAGOS NIGERIA, LAGOS",3.41639184951782,6.45668792724609,8371777e-1498-462e-a004-cf479a8946f9,6
AMACUFF LIMITED,"Block 1, Shop 1, Lsdpc Shopping Complex Esther Oshiyemi Street, LAGOS",3.39582920074463,6.45300769805908,7e28e38e-d4db-4238-b712-0f14ff4bae19,6
OFFICE MIRROR,"Office Mirror, 4C Idowu Martins, Victoria Island Lagos, Lagos,101241, Lagos, Lagos",3.42013502120972,6.43341541290283,bad99119-2247-4cc9-9bf8-ab695c24eb04,6
Workman by PC Ltd.,"No. 4, Yetunde Brown Street, Ifako Gbagada, Lagos, Lagos 100242",3.34812116622925,6.55936288833618,84d5fa1d-9fad-45cf-96d7-2598a7126328,7
IO FURNITURE,"6 / 8 Industrial Street, Off Town Planning Way, Ilupeju Industrial Estate, Ilupeju, Lagos State, Nigeria., Lagos, Lagos, Ogun",3.35032248497009,6.52552509307861,555d58f1-29f1-433a-827d-6a7d4f718eef,8
PAPERLAND INDUSTRIES LIMITED,"NO 7, BADEJO KALESANWO STREET, MATORI INDUSTRIAL ESTATE, MATORI, Mushin,100007, Lagos, Lagos",3.3498055934906,6.53911066055298,34156b48-38e1-4c3c-9e3a-436135bfdf46,6
JOSSY FURNITURE CARPENTER,"9 Oshuuba Street, Alimosho, Lagos",3.305415391922,6.61042451858521,8a44a92d-d5b7-4f1d-b374-d1adb8d3aa17,8
Blam Associates Limited,"18 Adeniyi Adefioye Street, Itire 101241, Lagos, Nigeria, Lagos, Lagos State",3.34237241744995,6.50837850570679,7de2b70c-74ee-4d95-9388-f41e8f15eef9,8
1401 Renovations Andinterior Design,"Block 6 house 9a howson wright housing estate olusosun oregun ikeja, Lagos, Lagos 110102",3.36999988555908,6.59987735748291,03a294f0-074f-4de8-9484-939c0e213b8a,7
Celplas Industries Nig. Ltd,"27/A, FATAI ATERE WAY, OFF LADIPO STREET, MATORI IND. ESTATE, MUSHIN, Lagos, Lagos State 1001",3.34499001502991,6.53948497772217,3800506b-7e92-48b9-9cba-6bcf637ab2b0,3
COSTAIN WEST AFRICA PLC,"Ebute-Metta, Lagos State 174",3.3755099773407,6.50650405883789,84dc160e-4890-4bc6-bc63-7f63ce101e43,9
Champagneandcigar Ltd,"House 12 3 Omole Estate Lola Holloway Street Omole Ikeja Lagos., Lagos, Ogun",3.36012506484985,6.63691997528076,3b1e95a4-3d28-45de-a954-a28dc12e0b8b,10
Svengali Designs Limited,"9 Agoro Odiyan Street, Off Adeola Odeku St, Victoria Island, Lagos, Nigeria, Lagos, Lagos State",3.41867709159851,6.42857980728149,2ef33573-0823-450e-8a54-181ecbb4e3a3,5
AMERICAN FURNITURE GALLERIES LTD,"23 Akin Adesola St, Victoria Island, Lagos, Lagos, Lagos",3.42391490936279,6.42592000961304,0a6a35b8-8cb4-43e5-adfe-b393c9fc53a1,6
Novena Majesty Furniture Industries Ltd,"Plot 141 Ahmadu Bello Way Novena Plaza, Lagos, Lagos",3.4239490032196,6.42259979248047,54af740b-6cc2-44ef-bd5e-70e9fc716972,1
EXECUTIVE ALABI FUNITURE,"Plot 78, Awolowo Road Ikeja, LAGOS, Lagos",3.41164994239807,6.44437694549561,69f0514f-937f-4401-beef-35eaf320d4a4,9
JADAPEARL INTERIOR LIMITED,"4A, Isheri Road, Ojodu Berger., LAGOS, Lagos",3.27096009254456,6.44866991043091,527101fa-7e6e-43b1-bbd9-ae9641fcfb45,5
A&C Manufacturing Company Limited,"SUITE B:164-166 IKOTA SHOPPING COMPLEX BY VGC, LAGOS",3.38527655601501,6.48870992660523,e5d05145-e054-41d1-8a22-824b31ceacd1,3
Olu Balogun Nigeria Enterprises,"No 162 Apapa-Oshodi Expressway Ilasamaja Lagos, Lagos, Lagos",3.31834888458252,6.4646258354187,839ca7e4-8c18-493a-9efd-c0c75e35ed22,6
Maolad Trading Company,"4 Waheed Akanni Street Ago palace Way.Okota Lagos, Lagos, Lagos",3.30459403991699,6.49708890914917,b082db8f-763a-48d0-a93f-cdc5dd364368,7
B.A.S Furniture Ltd,"26 Awanatu st Papa Ajao Mushin Lagos 234-01, Lagos, Lagos",3.33646488189697,6.5051851272583,11d9d344-55ff-4908-8193-d23140052f38,10
THE WARDROPE,"76 Adeniyi Jones, LAGOS, Lagos",3.34489989280701,6.61071014404297,266f09f0-f2ce-4b7b-8ea9-adf3eca2a9ac,3
Builders' Expressions Limited,"41, Osundairo street, Iyana Ipaja, Lagos",3.30550694465637,6.62005186080933,ff3c8ec4-265d-49c4-ae58-e80113a1d75b,9
PUO CONSTRUCTIONS LTD,"Alausa Shopping Mall Obafemi Awolowo Way, Alausa, Lagos",3.35242366790772,6.60952615737915,15239592-3ac8-45cc-9001-927ef37b0a9e,4
UNIVERESAL FURNITURE LIMITED,"Km 16, Ikorodu Road, Lagos State, Lagos",3.36758995056152,6.57140016555786,84c11e91-89f5-43c3-b334-d50f4840d1d1,10
International Metal Products Limited,"Plot 15/16, Block XIII Industrial Estate Ogun State, Ogun",3.37928056716919,6.50537109375,31ca98f0-9c17-4508-9b02-e72c4ac11223,5
TECHNICO LTD,"4B Oyeleke Street, Ikeja, LAGOS, Lagos",3.3589129447937,6.61106681823731,3391b309-e6f7-4bca-956b-e4a982b3e5b2,9
CAPRISAGE (EXPORT) WOOD FURNITURE COMPANY LTD,"1, Bola Ajibola Street, Lagos, Ogun",3.35522508621216,6.60044622421265,cc4e8136-a319-41eb-a59a-c6073cbefc84,2
Blinds Nigeria,"13, Ogundana Street, Ikeja,23401, Lagos, Lagos",3.35775995254517,6.60115003585815,cdc06e0e-7b03-4264-955b-1d291a2441d5,8
M O G Holdings,"103 Allen Avenue, Lagos, Ogun",3.35477495193481,6.6027250289917,0a7374f5-fe9c-4191-b509-24f15887e5cb,7
Sartorious Technical Services,"2 kudirat abiola expressway alausa ikeja lagos, LAGOS",3.35301876068115,6.60963106155396,5868b287-f87b-4b16-9847-11d1fe9cb2b8,10
360furniturehub Ltd,"39 Shasha Rd, Akowonjo 102213, Lagos, Nigeria, Lagos, Lagos State 102213",3.30663299560547,6.58945894241333,e7a900f5-798d-48dd-88fc-c7f41c37804c,6
Cejex Designs Nig Ltd,"Eastline Shopping Cmplx Block C1 �Shop 8/35 Lekki-Epe Express Rd., Lekki",3.54958820343018,6.44732093811035,08c48fd1-ba0d-4aca-b1a2-ae74a04e0b33,2
Swisstrade Nigeria Limited,"swisstrade House km 14 Lekki Epe Expressway Lekki Lagos, Lagos, Ogun",3.54118394851685,6.44239187240601,f63620a8-6f8a-411c-a405-22ed93697faa,8
Hayeseg Plumbing services,"No 18 Ebunolorun St, Somolu 100001, Lagos, Nigeria, Lagos, Lagos State",3.38290524482727,6.54350280761719,d5bb6184-50e4-45d6-acbe-752ffb7ba675,6
Unique Plumbing And Electrical Services,"Lagos,234, Lagos, Lagos",3.34870576858521,6.55915307998657,91c8289c-570f-4380-a624-642535e50fb2,4
FETTY PLUMBING WORKS,"12 Akinrinlo Street, LAGOS, Lagos",3.38348150253296,6.53099250793457,aac36891-1f90-46c5-9934-d4120143d02c,4
Plumbify,"12 tewogbade street Ikeja, 100213, Ojodu, Nigeria, Lagos, Ogun State 100213",3.42745041847229,6.46599102020264,6c7cc404-6898-418a-9bf4-8b50dbebcde3,9
OGA PLUMBER LIMITED,"9A, Alhaji Adewunmi Fowewe Street, Off Allan Balogun St, Eti-Osa, Lekki, Nigeria, Lagos, Lagos State",3.33918905258179,6.51204586029053,4fb2e0b9-d16a-42ac-9c64-0af37946d5ef,5
Olamide Plumbing Engineering,"72 Olorunsogo St, Mushin 102215, Lagos, Nigeria, Lagos, Lagos State",3.35483717918396,6.53714370727539,2f28a316-0dc4-403b-98be-323aa0b149ad,5
METRINY PLUMBERS,"1 Toluwaloju Olufemi Street, Ipaja, Lagos",3.34922623634338,6.50683212280273,8e61fa81-b1dc-4a84-89dc-c29031cb1b0e,5
Al-Mumini Plumbing and Water Treatmen General Contractor,"unity close off ifesowapo Egan igando LAGOS, Lagos,234, Lagos, Lagos",3.33780002593994,6.47000598907471,32363af7-7c23-400b-8490-04cc7bec0a80,5
MaC CJ England Luxury Bathrooms,"35, Association Road, Ilupeju, Obanikoro, Lagos, Lagos, Lagos",3.3641939163208,6.54738187789917,7115b361-6298-4624-9417-c217f22f8963,8
Payous Plumbing Engineering,"opposite tollgate, Babs Animashaun Rd, Surulere 101241, Lagos, Nigeria, Lagos, Lagos State",3.34856700897217,6.48258876800537,8b061b0a-7a84-4dc8-a285-7c3484918acc,3
Be Plumbing Services,"Abuja St, Banana Island 106104, Lagos, Nigeria, Lagos, Lagos State",3.4516544342041,6.46615886688232,52d57439-a03f-4e71-a48e-a07fdb23a205,3
Kings Home Sanitary Wares,"Divine Plaza, Shop 21, Mosholashi Street. Opp UBA Bank, Odun Ade Market, , Coker, Lagos, Lagos",3.35902810096741,6.50245809555054,d6ab627d-eb3c-4faf-b561-2d48df83e71c,9
Dial A Plumber (PlumberNextDoor),"16 Raymond Njoku St, Ikoyi 106104, Lagos, Nigeria, Lagos, Lagos State",3.42285966873169,6.44239330291748,9c08a975-988c-43e7-ac14-0d9c39b4ccef,9
PURIMATE WATER TECHNOLOGIES LIMITED,"Block 9 Shop 36/37, Lagos, Lagos",3.35297989845276,6.50950002670288,2a16db67-ba39-4d42-ac20-7ee052ba4a93,3
CAMBIELLI NIGERIA LIMITED,"No. 4, D Alberto Road,, LAGOS, Lagos",3.36624002456665,6.54242897033691,9771a851-3081-41e8-91cc-ec0c99de8376,5
Truchoice plumbing service,"7 Adamson St, Agboyi 105102, Lagos, Nigeria, Lagos, Lagos State",3.39104914665222,6.59952974319458,d13ee0ff-61ba-40c1-a328-0838af0b13a0,3
DELNICE NIGERIA LTD,"3 Godwin Okigbo Street, Lagos, Lagos",3.34887599945068,6.50244998931885,845c9e27-5d9e-4d58-88c3-b6e0f63ad059,10
Best Plumber Services.,"12E Admiralty Way Lekki Phase I Lekki, Eti-Osa, Lagos, Nigeria, Lagos, Lagos State",3.47003149986267,6.44791650772095,4dd11578-040c-4a26-8418-77ed0c24ed0d,9
MIZAMI,"Suite 21B West Pavilion, Entrance 1, Lagos Island, Lagos 102273",3.36895728111267,6.53980779647827,4846b82b-e1cf-4ab0-80a8-07e5b4c181c9,9
SEABRIDGE PETROLEUM LIMITED,"12, Obanikoro Street, Lagos, Lagos",3.36930394172668,6.54792499542236,6cb90d67-66c8-48d0-a5e2-71fb982260ae,7
Hizic plumbing engineering,"No2 oloowokere street onikanga Ayobo Lagos 4 oregunwa street oregun ikeja Alimosho,ojodu Lagos NG, Ayobo 100278, Ikeja, Nigeria, Ikeja, Lagos State",3.36700201034546,6.60120058059692,c39b9db9-8aa7-4490-882b-91a8a84a8319,9
ARTHUR ENERGY TECHNOLOGY LIMITED,"73, Okota Road, Lagos, Lagos",3.31880593299866,6.51722097396851,f9a2bc2c-2c36-4026-9707-9d16f7a3775b,6
Opakjephplumbing,"1,Oyetubo street Off Awolowo Way, Ikeja, Lagos Nigeria., Ikeja",3.34025955200195,6.6025857925415,04db733a-e47b-4560-bc7b-384cbcbc9601,9
Jay plumbing services,"8 Tonade St, Opebi 101233, Ikeja, Nigeria, Ikeja, Lagos State",3.32927203178406,6.60569524765015,c5aa4258-e44c-4286-bed0-7ad02e45e0e7,1
POLLUX ENERGY SOLUTIONS LIMITED,"49 Norman Williams Crescent, Lagos, Lagos",3.41806507110596,6.44368982315064,ba77d94d-43fa-40a2-a88b-08c16f20801c,9
PLUMBERS WORLD,"63,Paul avenue, Ojodu, Yakoyo Rd, 271106, Lagos, Nigeria, Lagos",3.3556399345398,6.65458106994629,d7857fa3-6785-4234-b7f4-d73aea5a00d5,10
mka plumbing and electrical services,"29/30 olaleke taiwo street, off Yetunde Morgan Ave, Ojodu Berger 100213, Nigeria, Lagos, Lagos State",3.35924792289734,6.6453332901001,64eb17b9-0143-4e05-bdb0-b431f88fc268,10
MAMAK NIGERIA ENTERPRISES,"12 Agidi Road, Lagos State, Lagos",3.40066409111023,6.59446001052856,ed8c2fb4-34db-4619-b58f-c23c4ce83890,5
PATHOIL LTD,"No 1 Mabinuori Daudu Street, Lagos, Ogun",3.37458610534668,6.61582279205322,f5915595-e59c-4cfd-b9cb-518cc867a4bd,1
RBNG,"2 Soji Adepegba Close, Ikeja, Lagos 101233",3.35183906555176,6.60210704803467,20c37f7f-e1cb-482d-b62e-41b1ba12ad72,2
Ocean Engineering,"13 Alimosho Rd, Alimosho 100275, Lagos, Nigeria, Lagos, Lagos State",3.30054426193237,6.61187171936035,ccb0232c-c9c9-45a8-9d43-60a060017e57,8
Paints,"Sandtex House, 105 Adeniyi Jones Ave, Ogba, Ikeja, Nigeria, Ikeja, Lagos State",3.34262752532959,6.60849666595459,4f257a53-e000-4be7-85e0-87e620dbea2d,2
TOP INLET ENGINEERING LIMITED,"Infinite Grace Plaza Wing A, 09 Oyetubo Street, LAGOS, Lagos",3.34051179885864,6.60193872451782,1233a55e-56f2-4bd7-8107-a153e36ee3b8,7
PAMAK,"12, Adegbola Street, Ikeja, Lagos",3.3259449005127,6.6108250617981,f17bb8d0-26af-4265-8f44-66b84263014b,7
EISNL ENGINEERING SOLUTIONS & DRIVES LTD,"Plot 9 Block A, Ikeja Industrial Estate,, Lagos, Ogun",3.36578011512756,6.60754919052124,1602e633-67ba-473f-a159-af84b89f4392,6
SWEBORG NIGERIA LIMITED,"10 Akinsanya Street, Of FRSC, Lagos State, Lagos",3.33985996246338,6.44285678863525,ead731b7-ef66-4564-999b-f029ffab3962,6
JG OIL FIELD SERVICES LTD,"No.9 Wailliams Close (By Babs Animashaun), Lagos State, Lagos",3.34590530395508,6.49154567718506,b939ac86-a819-41a5-8d44-68aca4992435,3
Gennex Technologies,"Plot 25, Adebisi Ogunnuyi Crescent, LAGOS, Lagos",3.33802008628845,6.46503400802612,b9751655-2369-4d0b-9c12-bb97f0e16ba6,2
DDVL,"Block 3, Shop 21, Awaye House Badagry Road, Lagos State, Lagos",3.32890510559082,6.47087383270264,f0dac30b-dfac-47d9-911e-efb797b3a823,3
BRUKAH GLOBAL SERVICES LIMITED,"Block A1, Cluster A 1004 Housing Estate, Lagos, Lagos",3.43428301811218,6.43945407867432,53b183c0-4367-457d-ba3f-e30c84bafcb1,6
Nagin Nigeria Ltd,"9 Creek Road, Lagos, Lagos",3.47488188743591,6.44023895263672,7db10cc1-1432-45f2-a0b2-91ae4cc9612f,2
MOTHERCAT (OVERSEAS)NIGERIA LIMITED,"13/17, Breadfruit St.,Box 1244, LAGOS, Lagos",3.38794112205505,6.4562554359436,0a9355dc-0a40-440d-8597-3644d73f0e40,9
CHRISSTAHL NIGERIA LIMITED,"02 Willoughby St, Adekunle, Lagos, Nigeria, Lagos, Lagos State 101245",3.38431906700134,6.47870922088623,738b8808-8444-467a-8cdc-80201418d608,9
BATLAN CONCEPT INTERIORS LIMITED,"Queens Shopping Plaza Suite 10/11 Km 45, Lekki Epe - Express Way, LAGOS, Lagos",3.39582991600037,6.45306015014648,3ca613c3-3afc-47c8-ae22-60a22b5c3831,1
STERLING AND WILSON NIGERIA LIMITED,"1435 A, Sanusi Fafunwa Street, Lagos, Lagos",3.42890501022339,6.43113899230957,0f28c223-29f6-4e2e-9ba8-5862a8fee98a,6
Alan Caray Technical and Logistics Limited,"10 A/b Eletu Ogabi Street, Off Adeola Odeku, Lagos, Lagos State 101007",3.41211485862732,6.4304575920105,42588ab0-1e36-4cef-86e2-d46897417249,2
Kingsmat Company Ltd,"30B Babs Animashaun Road, Lagos, Lagos",3.43599009513855,6.43444013595581,aba6bf1a-a7c2-4411-b078-098bb97f3128,7
HPM & ENERGY,"17a Olubunmi Rotimi Off Abike Sulaiman, LAGOS 23401",3.46836853027344,6.43807411193848,8a4c3344-b66e-4dd4-9ea5-c8fa9f20229d,2
GWILL INT MULTIVENTURES (Plumbing and Electrical Engineering),"1004 Estate, Adetokunbo Ademola Street, Victoria Island, Lagos, , Lagos, Lagos, Lagos",3.42940592765808,6.42650127410889,6a1367a7-fda1-4e17-907f-fd67f30f2737,3
MICOPLENIC CONSTRUCTION,"21, Ahmed Onibudo Street, off Adeola Hopewell St, 101241, victoria island, Nigeria, Lagos, Lagos State",3.42831015586853,6.43426942825317,d88276f2-ec97-4c55-8b45-ef844e01803d,5
GEOPELL NIGERIA LIMITED,"16 Omorinre Johnson Street, Lagos, Lagos",3.45996499061584,6.43645477294922,0b23daf0-a27d-4f9e-87ef-af8c0932adff,10
GEBERIT NIGERIA LIMITED,"7, HT Cool World, 307A Adeola Odeku St, Victoria Island, Lagos, Nigeria, Lagos, Lagos State",3.4226610660553,6.42926406860352,6a8458f5-c2cf-4b23-aad4-24889a166d4f,4
Technova Energy,"2A & 2B Abimbola Okulaja Close, Lagos State, Lagos",3.55401086807251,6.44774723052979,2ed99e20-c238-4a1d-98d9-5f3b349bb62c,9
SOLUTION PLUMBING WORKS,"Oremeji estate, Owode, Ibafo, Nigeria, Ibafo, Ogun State",3.42187404632568,6.74244165420532,ae132722-a351-4f8d-bd63-a0b6a82b8c81,6
Fix it Pro,"39 Obafemi Awolowo Way, Lagos, Lagos State",3.35507965087891,6.6137170791626,5e114520-925f-4db6-8d7a-ebff040e23dc,6
FIXMYPC,"13a Oremeji Street, Opposite Skye Bank Computer Village, Lagos, Ogun",3.33923506736755,6.59421110153198,edd43bac-9e9b-4064-b9d8-917b039af93a,1
ALLIED COMPUTERS LIMITED,"Ikorodu Road, Ilupeju, Lagos",3.36665391921997,6.55974006652832,d235505b-d02f-4889-ac44-35da10837d92,6
EXCLUSIVE COMPUTERS,"12, Oremeji Street, Off Medical Road, Ikeja Lagos., Ikeja, Nigeria, Lagos State 234",3.36479187011719,6.55060815811157,56553d1e-93f8-412b-ba48-e2847d98739b,7
ICT. computer repair and installation,"Adeye ni street Computer village ikeja, Lagos, Lagos State 234",3.33569145202637,6.59211874008179,070eab1f-c111-4e59-8371-0ce80e3146d6,7
Best Info Tech Services - Web Design in Lagos Nigeria | Computer repair Services,"8 Ola Ayeni St, Computer Village 101233, Ikeja, Nigeria, Lagos, Lagos State",3.39096117019653,6.5613374710083,0c59c7e6-d39a-42c7-8015-deb9586b9580,6
E-ekesons computer technology,"3b Pepple St, computer village 101233, Ikeja, Lagos, Nigeria, Ikeja, Lagos State 100212",3.36755728721619,6.55932188034058,aeefd999-f2c2-46f9-8563-00870f117f4c,1
Dervac,"76 Shipeolu Street Palmgrove, Lagos,100231, Lagos, Lagos",3.368403673172,6.54248714447022,0a37c9ef-9e77-4a97-b7c8-0a0a4ce77846,7
tech solution,"Lagos NG, 26 Owolowo St, Ikorodu 104211, Nigeria, Lagos, Lagos State",3.38093829154968,6.53736305236816,860cafdd-aa20-41f8-acac-3f2f687cc99b,4
Kes Computers Ltd,"90 Palm Avenue, Mushin, Lagos",3.35194611549377,6.53710794448853,c4b9d7c5-a16f-47ae-8e63-947cfe661e28,4
