Name,Address,Longitude,Latitude,id,Qualification
Professional Locksmiths Association Of Nigeria - Plan,"Banex Plaza, National Secretariat, Itire, 57 Ikorodu Rd, Mushin, Lagos, Nigeria, Ikorodu, Lagos State",3.50296926498413,6.61790800094605,597b4841-b41b-401d-986b-36470885aa5d,7
GT LOCKSMITH KEY DUPLICATING PROGRAMMER FOB BATTERIES & CAR DIAGNOSTIC SERVICES,"Block 13/14, Igbo-Efon, Lekki - Epe Expy, Lekki Penninsula II 105102, Lagos, Nigeria, Lagos, Lagos State 105102",3.41171717643738,6.44905376434326,09467a82-71d1-4f2e-82cc-b6b81977ad2c,9
Major Locksmith Nigeria Limited,"Kiosk, Tafawa Balewa Square Complex, Race Course, 14 Tafawa Balewa Rd, Lagos Island 102273, Lagos, Nigeria, Lagos, Lagos State",3.40112161636353,6.44524621963501,183186bf-afda-4e73-9d9f-72b2d6a09649,3
Phymocool Car AC Repair & Installation,"29 Balogun St, Yaba 100001, Lagos, Nigeria, Lagos, Lagos State",3.3770444393158,6.53415775299072,2ba1856d-184e-42bb-a67b-92c6a991fe3a,2
OFTECH,"162 Borno Way, Lagos, Lagos",3.37642598152161,6.50048208236694,bdcba56a-6f72-4262-9039-4112876a22c5,3
COOL PLUS,"Sura Shopping Complex Simpson Street, LAGOS, Lagos 101223",3.40425992012024,6.45446300506592,afb54dac-e211-426e-b7a9-1fe5e4c4da2b,8
"Technoton Ltd: Air Conditioning Contractor in Lagos, Nigeria - HVAC Sales, Repairs, Maintenance","5 Adeola Odeku St, Victoria Island, Lagos 106104, Lagos, Nigeria, Lagos, Lagos State",3.41379451751709,6.43061780929565,f755c74b-9565-4017-afa0-2f796baa9011,9
Autopholex technical car air conditioner,"down down PGH, Ebute-metta Oyingbo, Ondo St, Lagos Mainland 101223, Lagos, Nigeria, Lagos, Lagos State",3.38461327552795,6.48527765274048,442de8b1-fc23-4752-9c3c-fe1fa0d74aff,4
"Technoton Ltd: Air Conditioning Contractor in Lagos, Nigeria - HVAC Sales, Repairs, Maintenance","9, Ademola Street, Off Awolowo Rd, Ikoyi 101233, Lagos, Nigeria, Lagos, Lagos State",3.4172043800354,6.44188499450684,159dd78e-d127-4830-a7b5-cc93cc77a0c8,5
Satek Nigeria Limited,"8 10 Ilupeju Bye Pass, Lagos, Lagos State",3.35647988319397,6.54422998428345,c4b6a29c-9672-43ad-83de-c546e5acb353,5
ABENCO TECHNICAL SERVICES,"104c Itire Road Obele, LAGOS",3.33543920516968,6.51103830337524,2e20eae6-71f3-46ff-911e-01e72a8b1a48,8
Toptech Engineering Limited,"9, Oguntona Crescent, Gbagada, Lagos 23401",3.37480688095093,6.55007600784302,a853a2a4-d3e6-459e-95dd-921d2ea8be9f,9
CA CONSULTANTS LIMITED,"Uba House 57 Marina, LAGOS",3.38296318054199,6.4552788734436,64939a24-d53b-46a5-a917-5fd3f4f5ea2e,4
RCN NETWORKS LIMITED,"12C, Oko-Awo Close, Lagos, Lagos",3.42771601676941,6.42859506607056,f20994cf-4081-4db2-ac2e-68988c40ff04,4
Lubaz Tech | AC Repair in Ikorodu Lagos | Car AC Repair,"Block 5 plot 18 Zainab Ajoke Street, Alogba St, Ikorodu, Lagos 104101",3.48760795593262,6.59183692932129,88db0129-7c53-4d22-820e-437c7cb0ee7a,4
MECEL ASSOCIATES NIGERIA LIMITED,"70, Modupe Johnson Crescent, Lagos, Lagos",3.35904693603516,6.49230813980103,d301cd7d-9c34-4016-82f3-9ba4db89e1de,2
ATLAS COPCO NIGERIA LIMITED,"Plot 110/114 Apapa-Oshodi Expressway, Isolo, Lagos, Lagos State 101241",3.31834888458252,6.4646258354187,903c9dd3-d54d-445a-bc79-5f011c136f8c,8
CURTIS ENERGY COMPANY LIMITED,"81 Obafemi Awolowo Way, Lagos, Ogun 105102",3.34044003486633,6.59678316116333,eeda6f37-1021-4446-aea6-3ac413af6019,4
TECHNOTON ENGINEERING & TECHNICAL SERVICES,"9 Ademola Street, Lagos, Ogun 101233",3.35885095596313,6.49814605712891,ad1a1aab-59d9-495a-aadb-971ebc602ad5,9
STAR COMPRESSORS SPARES LTD,"Ademola Ogunsola Street, Lagos, Ogun 101281",3.31623506546021,6.66191005706787,7bd00237-fcb7-4fd4-9c5d-ed9040fd3463,7
MUSTARD ENERGY LTD,"27A Oyinkan Abayomi Drive, Lagos, Lagos",3.45084691047668,6.44413614273071,dab2711f-ee99-4bc7-ba24-a5e384d863cb,2
NEW ENERGY SERViCES COMPANY LIMITED,"292H Ajose Adeogun Street, Lagos, Lagos",3.43755698204041,6.43089008331299,ab50bb6d-57c1-46dd-a11f-4660f812616e,6
Wilkriss Nigeria Limitied,"18B, Grace Anjous Drive, LAGOS, Lagos",3.4579598903656,6.44146490097046,e52a622b-22da-4351-846e-23bb28ca9661,7
UNITED TECHNICAL & ALLIED SERVICES,"110/114, Oshodi-Apapa Expressway, Lagos, Lagos",3.34267997741699,6.55629014968872,79025295-6176-41fe-a315-cf3397e9b146,7
BEAMCO,"3, Solomon Agbontan (Aerodrome), LAGOS, Lagos",3.37686896324158,6.6344780921936,7f0a4f47-d040-4129-8ca2-10d4e0f9d7ca,4
FORMEX INTEGRATED SERVICES LTD,"Ikorodu Road, Mile12, Lagos",3.39541840553284,6.6093430519104,a841827d-8877-40af-a2e2-e9f1528d449e,1
John West International Limited,"51 Opebi Road, Ikeja, Lagos State",3.35536289215088,6.59552478790283,e060ae37-4ef7-4278-b207-0824a0f04c41,1
GAS AIR,"Plot 5A General Aviation and Industrial Estate, LAGOS",3.32502198219299,6.47267818450928,4da4ce57-5692-421d-b675-0f16645dd7b4,5
Air Solution Nigeria Limited,"Ilupeju Road, Lagos, Lagos State",3.35634994506836,6.53881072998047,c0bdc4c2-5b9f-47bd-ac70-90b23aa8575b,7
Mandilas Group Ltd,"Mandilas House, 96/102 Broad Street, Lagos, Lagos",3.38811993598938,6.45445013046265,4b199c8e-ef94-43a7-b01d-40d730e92ba0,9
A-LINE ARCHERS CONSTRUCTION LIMITED,"No.127 Herbert Macaulay Way, Lagos, Lagos",3.37732791900635,6.50257110595703,9db623ed-c5ca-4b7b-85ad-e9f7d3e13d98,3
Mizbeach Limited,"56 Allen Avenue, Lagos, Ogun",3.35213994979858,6.60143995285034,e47a4a5e-b414-4061-8121-c3c127d5b215,8
FAKBIRDS SERVICES LIMITED,"No. 64 Toyin Street, Lagos, Ogun",3.34757399559021,6.59632301330566,05235113-76fa-4791-a465-7956ccd5391f,7
BLUE OCEAN,"23 Ladipo Oluwole Street, LAGOS, Lagos",3.29446792602539,6.54662418365479,da296310-0a6d-4067-902c-7fe900af6c6c,7
JMT,"26 Buhari Street, Lagos, Lagos",3.35125303268433,6.53615999221802,f22adf1a-edfc-42d0-89b4-9717dbfe9d7b,8
Starshield Technical Services | AC / DC Rewinding | Home appliances repair such as: washing machine/ microwave/ pumps,"3 kehinde jimoh street unity Estate, Lagos, Ogun 111115",3.41519808769226,6.72013711929321,4cce042a-a415-403a-98b6-2fc7aabe1c48,9
ELPINA ASSOCIATES LIMITED,"18B, Creek Road, Lagos, Lagos",3.37811493873596,6.44153499603272,ccaaf5bd-cc07-4851-b8d9-c46975e97048,7
ELIZENO ENGINEERING NIGERIA LIMITED,"19, Adetola Lane, Lagos, Ogun",3.37093591690063,6.53390121459961,946089a1-b277-4596-a7b5-fac5511e3be5,4
TECHNOTIME LIMITED,"404 Road, Lagos, Lagos",3.28478598594666,6.47780990600586,ded7643c-c49e-4f26-9ae8-73b9e647b53b,2
ANOINTED BLESSED ENG.CO.LTD,"Taiwo Close, Lagos, Ogun",3.32812905311584,6.66617012023926,ffd83b1f-fc42-401f-baad-dee1c5e70bef,8
interior decoration,"95,owutu isawo road agric ikorodu lagos, lagos state 23401",3.50483083724976,6.62370443344116,fc1fba81-d41a-45c5-a99d-51874c33a160,7
ART WALL INTERIOR DECOR,"Ikorodu Road, Ikorodu, Lagos",3.49453663825989,6.62415981292725,c43bac29-388d-4a57-99c0-b6442d2683db,1
HomeWorth Interiors,"Lekki, Lagos,23401, Lagos, Lagos",3.54764938354492,6.44812536239624,35415146-3a8d-42e5-84ab-4a46c7017501,1
RABSON INTENSIVE FURNITURE & INTERIOR DECORATION,"70 Ireshe Road, Ikorodu, Lagos",3.50521159172058,6.61085891723633,4a038112-542c-4a5a-94ed-841c8eae22a6,7
BASIL INTERIOR DECORATION ENTERPRISE,"Ayangburen Road, Ikorodu, Lagos",3.50175714492798,6.61421155929565,59f18aed-739c-492a-9414-5fd2f89bbf53,5
HASSMIMS VOGUE INTERIORS AND DECORATIONS,"Owolowo Street, Ikorodu, Lagos",3.50437879562378,6.61320638656616,677387a1-3b65-4ba7-a995-674cdd4c14d2,1
Maven School of Interior Decoration and Design,"2A Oladipo Soyebo Cl, Omole Phase 1, Ikeja, Nigeria, Lagos, Lagos State",3.37524032592773,6.63281059265137,dd7a3d25-e110-40b9-aa87-8f71ba324809,6
G-Tec Furniture And Interior Decor Ltd,"Matt Plaza, Langbasa Rd, Aja 106104, Lagos, Nigeria, Lagos, Lagos State",3.5841372013092,6.50028467178345,bf4764df-24ee-4d1f-a5c2-46216277d0d8,6
HILLS INTERIOR DECOR,"32 Orishigun Street, Orishigun, Lagos",3.39005327224731,6.60138368606567,17598790-d32c-4dc2-a450-40fe7ae090cf,8
Abilink Interiors,"No 36, Ijaiye Road, Opposite LG Showroom, Caterpillar Bus Stop, Ogba Ikeja, Lagos NATIONWIDE DELIVERY AVAILABLE, Lagos, Lagos, Lagos",3.33952951431274,6.63117218017578,2962bbfd-4143-44c3-a4fa-527cae3208b9,9
BURNVIEW INTERIOR DECOR,Lr No 209/928/2 Lagos Lane,3.36482071876526,6.59561538696289,285c63bd-806d-4179-b647-b82776f01d9c,4
Aso Oge Fabrics and interior decor,"31 aladelola street ikosi ketu, Lagos, Lagos, Ogun",3.38103079795837,6.60442399978638,1c30ce58-9e2e-46a5-8bbc-0d5c3cb46055,3
13 INTERIOR & DÉCOR,"8 Ola Ayinde St, Opebi 101233, Ikeja, Nigeria, Ikeja, Lagos State",3.3472638130188,6.59414911270142,d4b3ad4e-08fe-435b-9016-a6319045a6e8,6
JANGRAMZ GLOBAL PROPERTIES & INTERIOR DECOR,"Ikota Shopping Complex Victoria Garden City, Lekki",3.55616617202759,6.46436500549316,ef9a55c1-f735-451e-84f9-3ce3eb19bbe7,8
DARING INTERIOR DECOR,"Yaya Abatan Street, LAGOS, Lagos",3.34054064750671,6.63607788085938,079c6521-bc5f-4ff2-91a6-f6cb83dd8357,10
BARRACK INTERIOR DECOR,"3 Ajogbedun Street, Zone 4, Ibadan",3.33431100845337,6.64290428161621,e3c6f50a-ed0b-4d34-bb7c-5f23dd897f35,5
Doxology Interior Décor,"Lagos, Lagos, Ogun",3.33422994613647,6.62360000610352,3c595c94-0e43-46d7-8847-39b88f9e9674,7
Sky world interior decor and Lightings,"105 Obafemi Awolowo Way, beside mobile filling station. Airport Hotel, Ikeja, 100271, Lagos, Nigeria, Lagos, Lagos State",3.34949851036072,6.60747194290161,280af0b5-17d3-46f7-8577-a7f766175686,6
DIAMOND INTERIOR AND EXTERIOR DECOR,"14 Poboyejo Estate, Ikorodu, Lagos",3.3764488697052,6.50293779373169,b5114e13-ec02-49c8-82cc-d9e1a8860a6e,4
JP interior desinger,"Lagos, Lagos",3.37134003639221,6.50946998596191,5adb2767-5664-4965-97a0-c51b2f798b9d,10
"Maven School of Interior Design and Decoration Palmgroove,Yaba.","19 APATA STREET,PALMGROOVE/ONIPANU,YABA LAGOS., Lagos, Lagos State +02",3.3859589099884,6.53320503234863,61a2c505-db83-46c0-88e1-0c8b36a97c62,1
Chemhap interiors,"7 kokoro abu road, gbadamosi house, ikorodu, Lagos,23401, Lagos, Lagos",3.39582920074463,6.45300769805908,d63fd5e0-0fba-41a4-8b8b-64d22b8e874d,1
pop interior nd exterior decoration,"28 benco street Aboru Iyana Ipaja, Lagos, Lagos +123",3.39831185340881,6.45318365097046,0fe892a3-17ba-4489-a8fd-ad8c56b8b4d2,3
Interior Decoration,"Shop No. E3, Mouque Plaza, 10 Ojuelegba Rd, Yaba, Lagos, Nigeria, Lagos, Lagos State",3.36217474937439,6.51029205322266,85ee6762-5184-4cdd-804d-d7874ec5b44f,3
COUPLES & KIDS INTERIOR DECOR,"5 Adedeji Close, LAGOS, Lagos",3.45656991004944,6.44256782531738,c5641495-bb3f-4cad-8b5d-b72e85d5716a,3
GOD'S PLAN INTERIOR DECOR,"Ibrahim Taiwo Estate Pompamari Low Cost. 119 Ojuelegba Road, LAGOS, Lagos",3.36316990852356,6.51009178161621,55e0a188-4478-4944-ba0d-de607672b779,3
Ola_interior_decor_store,"Moyosore Aboderin Shopping Mall, Oyetayo St, Mafoluku Oshodi 100261, Lagos, Nigeria, Lagos, Lagos State",3.34618854522705,6.56286668777466,b42d764d-15b0-47a3-8b75-9ba9e3400274,9
PERFECT TOUCH INTERIOR & EXTERIOR DECOR,"Oshorun Heritage Estate Tony Idowu Close, Idowu, Lagos",3.48028707504272,6.45458984375,67521910-969d-4824-b644-6d353a4cb189,7
Omotuns interior decoration,"house 4 onitiri estate, ojodu abiodun road, Lagos, Lagos 2341",3.39582920074463,6.45300769805908,2efc5451-5e14-45fb-bc6b-9a0dfc96628f,2
PINGO INTERIOR DECOR LTD,"Muri Okunola Street, Muri",3.4423189163208,6.43485927581787,ff66d213-cfd7-4cd1-9c64-c246e811f551,3
Real1 Interior Decorations,"31, Abeokuta Express way, Cement Bus stop, Dopemu., Lagos,2341, Lagos, Ogun",3.33045673370361,6.60425615310669,cdeb0520-1ac9-40f8-84fe-830e08545482,5
MOPEL Interior,"Gowon Estate, Lagos,+234, Lagos, Lagos",3.34870576858521,6.55915307998657,5c87fac0-c658-40d5-940a-86e1d263bcc3,4
Exquisite Designs & Decor | Interior Design Firm in Lagos,"Off Murtala Mohammed Int'l, 13 Fowora Close, Airport Rd, Ajao Estate, Lagos, Nigeria, Lagos, Lagos State",3.33718991279602,6.58997964859009,8c16d170-e58d-4cbf-8085-38ee84f8796d,9
B&T Interior Design,"GOLDRIM PLAZA, 1/3, MOKUOLU JUNCTION, Yaya Abatan Rd, Ogba, Lagos, Lagos, Ogun 101323",3.34325194358826,6.64394903182983,6e64236a-c123-48d3-ab0f-ef5c0dc82736,8
Soledoge Interior Design And Decoration Academy (Sidda),"27, Amore Street, Off Toyin Street, Off Allen Avenue, Ikeja, Lagos, Lagos 23401",3.35182309150696,6.60209846496582,861740f7-6b35-46e7-bc41-450e0117d802,4
O7Furniture - Corian Furniture Design and Interior Decoration,"1 Morenikeji St, Allen 100271, Ikeja, Lagos, Nigeria, Lagos, Lagos State 110105",3.39216017723084,6.54755926132202,7c32f8f6-53df-48ad-8935-dc50ebf9a11a,4
CVL Interior decoration,"3, John Olugbo Street,off Obafemi Awolowo way,Ikeja, 300001, Ikeja, Nigeria, Ikeja, Lagos State",3.35592460632324,6.61253976821899,61152ffe-b818-4a21-b02b-c907ab4cd22e,3
BUSDAM INTERIOR DECORATION CONCEPTS,"Ayinke Street, Bariga, Lagos",3.38502621650696,6.54311323165894,9e1abc95-bcce-49f8-a848-7855043deb64,1
Akinbamiro Interior Decoration,"13 Adedoyin St, Ketu 300001, Lagos, Nigeria, Lagos, Lagos State",3.3464457988739,6.63677310943604,63c701b6-7554-46dc-a888-c238eee44cf4,4
Unique Masters Interior & Exterior Decor,"26 Ajayi Road, Aguda, Ogba, LGA, Ifako-Ijaiye, Ikeja 100001, Lagos, Nigeria, Lagos, Lagos State",3.34431576728821,6.64600610733032,a6b3a98d-ab69-43e9-8fe7-d8194bc4aa77,5
101 INTERIOR DECORATIONS,"15 Abiodun Adeyemi Street, Ojodu-Berger, Lagos",3.33351707458496,6.63469982147217,1a3f33bd-bff6-465b-b1c8-d70a401108cb,9
Decor & Rainbow,"2 Opebi Road, Lagos",3.3653576374054,6.58457660675049,dda757c4-71d3-420a-8cb4-6846b5fbaa41,7
SAMMYSAM INTERIOR AND EXTERIOR DECOR,"Adeyemo Complex Adebayo Street, Adeyemo, Ekiti",3.3644711971283,6.64814329147339,945dcd85-e198-496e-9cea-68995df8505b,2
Agathas Interior,"Local Government Area, 200 Awolowo Rd, Ikoyi 101233, Lagos, Nigeria, Lagos, Lagos State 101233",3.41779541969299,6.44205951690674,75b576aa-e24e-4dd4-b870-2da6bbaf09ca,2
KIMDEC MULTIVENTURES & INTERIOR DECOR,"6 Kadiri Street, Jibowu",3.31723141670227,6.61546421051025,5813ab35-498e-4e45-94cd-ed762c9f28bf,9
NAOJOE DISTINCT INTERIOR & EXTERIOR DECORATION,"20 Oshodi Road, Oshodi/Isolo, Lagos",3.41076040267944,6.4561972618103,632601d7-db82-4fdd-81b3-8ec46cd4ab80,4
Guidelines Home Decor Interior,"58a Ondo St, Ebute Metta 100001, Lagos, Nigeria, Lagos, Lagos State 100001",3.38845872879028,6.48209285736084,d66f70b6-d625-4344-a40a-04f6846eccba,8
Exotic Interiors,"17 Olayiwola Street,Off Charity Road,Abule Egba ,Lagos, Lagos, Lagos, Lagos",3.39582991600037,6.45306015014648,459e8649-9e5a-4c4a-8816-5c196d1df761,6
Anyibest interior decor,"YABA TEJUOSHO MARKET shopping Yaba, Lagos 100011, Lagos, Nigeria, Lagos, Lagos State",3.3817834854126,6.49078226089478,5b95a845-cace-4031-a9f8-d4f43353d8e8,5
Shekinah Dynamics Interior & Exterior Decor.,"Block A2 - 11, Suite 311, Sura Shopping Complex Simpson Street,, Lagos Island, Lagos state 234",3.40379166603088,6.45512771606445,1afea1b9-66e7-4470-9d12-bfac016e0df8,1
HNK Interiors,"16B, Admiralty Way, Lekki Phase 1, Lagos",3.45507097244263,6.44027185440064,2f87d1d5-acf5-41d5-9ec6-13004f1a0049,10
Alluring Interior Designs and Deco,"Lagos, +234",3.39417958259583,6.4550576210022,d058b8a4-12ab-4d34-a77d-078c6aaeb2bf,8
crystal interior decorations ltd,"house 8 , plot 4 Tanwa Abudu Close, U turn Bus Stop. Abule, Lagos, Ogun 234",3.37842011451721,6.51279735565186,a67a1891-ad3b-4dc6-a7d4-157d4269f7be,8
"Full house interior decoration..... Painting, wallpaper, pop, screeding","local government, 46 Ososa Ave, Bariga 102216, Lagos, Nigeria, Lagos, Lagos State",3.39507007598877,6.53860235214233,2d8d9b11-4892-4d89-ae3a-a72200f6f136,4
CoZy Beddings and Interior Decoration,"15 Olakunle Ajibade St, Ojota 110001, Lagos, Nigeria, Lagos, Lagos State",3.36916279792786,6.51003503799439,e75a2d7c-3321-4374-9243-d7c911991dc8,4
HOME MATE INTERIOR DESIGN DECORATION,"106 Adeniji Adele Road, LAGOS, Lagos",3.39308762550354,6.45943307876587,fbec573e-655a-4394-88ba-d885dff1b2d2,3
TEEJAY INTERIOR HOME DECOR,"65 A Ojuelegba Road, LAGOS, Lagos",3.3701434135437,6.50908899307251,ce5e6628-e3d0-4d1c-93ee-afb4c9c3c283,4
KAZLEM INTERIOR DECOR,"72 OLORUNSOGO STREET, Mushin, Lagos",3.37188243865967,6.53865718841553,f59ed84d-cd50-4b39-9589-314e017e2276,5
KENSUZ HOME INTERIOR AND EXTERIOR DECORATION ENTERPRISES,"Harmony Estate No. 1 Kensuzzanne Drive, Iba, Lagos",3.39624810218811,6.45092153549194,47ce83db-ddfc-4d67-bd9f-8bbab5dc01b4,10
SHINETEX INTERIOR DECORATION,"3Rd Extension, Akerele",3.35309672355652,6.50590991973877,bd5233de-8c32-4ed8-b90b-9c57370dd8e1,5
VINTAGE DELUXE INTERIORS & DECORATION LIMITED,"No. 35 Tejusho Street, Yaba",3.36922192573547,6.5052056312561,6b1a3862-07ae-457c-afc5-3a82371d1182,3
CREATIVE INTERIOR DECORATIONS,"Mushin Road, Ikate, Lagos",3.3404688835144,6.51262474060059,a0686e2d-daf7-422a-9964-a461b641328c,5
Valentine interiors decorations,"127 olo drive by corner bus stop Ojo Alaba, Lagos, Nigeria, Lagos, Lagos State",3.32447910308838,6.4643874168396,f001f7c4-2ece-49fa-be52-8660ca303466,9
Ola’s Interior Decor Store,"29, Oronna Street Oshodi Isolo, Lagos",3.34327387809753,6.5604133605957,e2849c5d-9cc5-45e5-8266-3937d35481f0,1
Querida Living Interiors,"Gbagada, Lagos, Lagos, Ogun",3.39289045333862,6.54290914535523,1aa6044f-779b-4525-ac71-3d43b43602cf,10
CHIVIN MULTISERVE INTERIOR DECORATIONS ENTERPRISES,"Ayilara Street, LAGOS, Lagos",3.36259841918945,6.5129189491272,438b4cab-16d7-402d-9171-9ce544218c6c,6
CLINJEF INTERIOR DECORATION,"45 Olorunshogo Street, Mushin, Lagos",3.35511875152588,6.52897787094116,7a441701-b66c-4d41-9502-ca7ea44b57d0,1
SUPREME EXTERIOR AND INTERIOR DECORATION,"Chris Madueke Street, Lekki",3.46237635612488,6.44066762924194,ed9a3710-d9e2-471d-9dae-93606bbc59c0,10
Antholyd Lighting and Interior Decoration,"22 The Providence St, Lekki Phase 1, Lagos 101233, Lagos, Nigeria, Lagos, Lagos State",3.46078205108643,6.43187093734741,9178a021-95d6-4e27-80f3-ce6241c628c8,7
OLAOBA INTERIOR AND FASHION DECORATION,"Olaomoju Abimbola Eluyera Elujide Phase 1, Abimbola",3.47246146202087,6.4450888633728,ac18905a-ee12-4ae7-8fc8-c92ab6573db1,9
Chuvie Decor Branch,"Barbeach Tower Block 5, Victoria Island, LAGOS, Lagos",3.43954348564148,6.4285740852356,6c45e19b-efa3-4937-a700-fce6db2539a4,5
Titemi home décor and interiors,"Lekki, Lagos, Lagos",3.47471356391907,6.43194007873535,608265b2-dd2c-4872-8800-0f6c8164c17b,6
BORNWEALTHY FURNITURES AND INTERIOR DECORATION,"5 Dele Amuda Street, Lekki, Lagos",3.49737882614136,6.427978515625,09dd2ef4-00af-4ed2-a233-8a0adb8c9059,6
Mufty interior Decorations Global Ltd,"Lagos road epe, Lagos, Nigeria, Lagos, Lagos State",3.5425431728363,6.44630670547485,c681f0ef-a4a7-4b8a-83b5-985946621ba0,2
BLUCREST FURNITURE & INTERIOR DECORATION LIMITED,"Demex Mart. Lekki-Epe Expressway, Km 35, Epe, Lagos",3.54093027114868,6.44245958328247,1555a6d9-b507-4217-ae28-52c450babaea,5
TUNEX INTERIOR DECORATIONS,"Lekki Epe Expressway, Epe, Lagos",3.65264225006104,6.46909523010254,81dfd391-8247-4e0c-bef3-c5e08b334412,7
Mide interior decor,"54, coast street ebute meta lagos, Lagos, Lagos +234",3.39582920074463,6.45300769805908,419f58c9-7200-4ae6-b2d0-18661edfb0d5,1
MORFIT INTERIOR DECOR & FURNITURE LTD,"Klm 35, Lekki Epe Expressway, Ibeju",3.72619104385376,6.47299766540527,058e4264-1ff7-4da1-b638-73b677deca29,10
Interior Decoration,"5, st saviour street okota Lagos., Lagos, Lagos 23401",3.33232831954956,6.62383604049683,86fd29ef-5baa-4d14-8dcd-6c61175f749c,5
Hupducon Interiors,"Lagos, Lagos",3.39582991600037,6.45306015014648,b2b74684-864b-46be-a108-15db5566f575,7
Stalite Realtor & Interior & Exterior Decor,"Private Address in Lagos, Lagos",3.39580011367798,6.45310020446777,6686ad82-e83a-4a44-a9c1-864882fef274,1
Adore Interiors,"64, Ijaiye Road, Ogba, Ikeja, Lagos,23401, Lagos, Lagos",3.34842824935913,6.63520526885986,0e3297d0-7df5-418d-8b24-7db16afe7149,5
Qdlexy interiors decoration,"Private Address in Lagos, Lagos",3.39580011367798,6.45310020446777,bf11a0b8-7f79-4921-87bf-db5993438943,7
halfkast interior deco,"Private Address in Lagos, Lagos",3.39580011367798,6.45310020446777,3a24ece1-c577-4472-a39a-c15e6230fdc7,3
MIKE_C INTERIOR DECORATION NIGERIA,"Ikorodu Road, Fadeyi, Lagos",3.40299129486084,6.60385274887085,2eebfb9d-4583-4d22-8ccb-eb4c6a810585,9
ZUNACCI INTERIOR DECOR AND HOME ACCESSORIES,"Ebun Street, Abule-Oja, Lagos",3.3118007183075,6.62308073043823,a95cfdbf-7458-4ea5-bba7-a2e88c9baf9a,9
DIVINE IMPACT INTERIOR DECORATION VENTURES,"Badagry Expressway, Badagry, Lagos",3.1770350933075,6.4802131652832,cb2c4e9e-4089-4b60-bc24-7cbd0de5083e,8
Interior Designer,"Private Address in Lagos, Lagos",3.33038997650147,6.60501480102539,0861ba38-592c-4948-b8a1-e89b8fff9e45,5
Dammy - Land Furniture & Interior Decoration,"Along ado odo road owode yewa Ogun state, Owode, Ogun State",2.9833300113678,6.69999980926514,5cd98030-0680-4da6-9005-b9c846ceacce,8
dexotic interior decor,"blk8, flat10, agege lane dophin estate, Lagos, Lagos 234",3.27866697311401,6.57885408401489,282644ff-c554-40f1-bbfa-eee449cf9f33,7
Home Interior Decorations,"Shop 32 Water bustop, Ipaja road Alimosho, Ipaja 100278, Lagos, Nigeria, Lagos, Lagos State",3.29791593551636,6.61389255523682,e0cddf28-a9b3-45e3-8801-c18ea9433944,1
PICK YOUR EXCELLENCE FURNITURES AND INTERIOR DECOR,"2 Alhaja Pupayemi Street, Ijebu Ode, Ogun",3.26855659484863,6.54900360107422,6f81616c-324a-4755-ad97-e4bb2d35c660,1
KUNMICK INTERIOR DECOR,"20 Duduyemi Street, Egbeda, Lagos",3.2881805896759,6.59525775909424,85fb48df-4675-4af8-8871-f82d7b037795,3
ISTAJ INTERIOR DECORATIONS,"No. 16 Ogun koya Street, Yaba",3.34074091911316,6.56372880935669,85cb8fe9-9ee0-41d5-bd19-5c98fbc2b871,2
ABIDOLU FURNITURE & INTERIOR DECOR,"Fajumobi Street, Egbeda, Oyo",3.29691410064697,6.60455799102783,c16680ea-e82f-4bce-857c-071eca72df77,3
COMFORTBEDDINGS AND INTERIOR DECORATION,"4 Harrison Solaja Street, Ago, Lagos",3.30443978309631,6.51224946975708,7fd64587-b6b7-475d-8568-d7182d610030,1
HYBEZAT INTERIOR DECORATIONS,"Idimu Road, Egbeda, Lagos",3.28451561927795,6.58538055419922,b56e8d2c-8f75-4160-9572-5f0c0af49cd4,6
Decor Lounge Interiors,"21B Adebisi Ogunniyi Crescent, Lekki, Eti-Osa LGA, Lagos State., Lekki 23401",4.09999990463257,6.41669988632202,5a7f0eb2-75f1-4f46-b9e4-cb95971a2a01,9
OMD Art & Interior,"Plot 1 Ajikatu Mogaji, Oro House, off Oke Ira-Nla bus stop, Ajah Lagos., Lekki,+2348136075877",4.09999990463257,6.41666984558106,1a15c076-d3fc-4746-8e09-14693a8657b6,10
BAKEM INTERIOR DECOR & SUPPLIES,"Pearls Estate Abisoye Jaiyeola Street, Lekki",4.11813640594482,6.50656652450562,9ddfbc4e-be98-4121-bef8-77b33bc009f2,6
OLWILLS TOUCH INTERIOR DECOR,ALAKUKO +234,4.15774440765381,6.74192476272583,4aa1053f-1db1-4f7e-a372-a33879b09456,4
XP Barbers,"1 Victoria St, Ojota 105102, Lagos, Nigeria, Lagos, Lagos State 23401",3.39193987846375,6.50381326675415,b6959ec3-39be-463f-a0b6-6e0581702822,10
Frontrow Barber's,"103,Apapa Road, Ebute-Metta, Lagos, Lagos",3.37474012374878,6.4817156791687,1c542433-e2f2-4e8a-9161-948a889b3d16,10
Dare Barber Shop,"H6, MABOREJE MARKET, Lagos Island, Lagos, Nigeria, Lagos, Lagos State",3.38030076026917,6.53293609619141,c56725a2-5e4e-4b29-9ba1-606f4d19831d,1
Captain Barbing Salon,"11 Ajose St, Surulere 101241, Lagos, Nigeria, Lagos, Lagos State",3.38848400115967,6.49014616012573,4baed96b-6e29-44e2-ab47-b987181569a8,5
HairbyTomiee,"Olanrewaju St, Bariga 102216, Lagos, Nigeria, Lagos, Lagos State",3.39155983924866,6.53301239013672,37eeaf5d-2626-4f4d-8bb9-5c841ce8b544,9
Ismail Hair Salon,"14 Anuoluwapo St, Alimosho 102213, Lagos, Nigeria, Lagos, Lagos State",3.37696957588196,6.53211688995361,a651adce-c304-4002-895d-8b1cf899a162,10
Abiodun barber shop,"291 Herbert Macaulay Way, Yaba 101245, Lagos, Nigeria, Lagos, Lagos State",3.3774905204773,6.50165510177612,40958440-229d-4eb6-a7c4-b42c6fca72df,4
Ozone Barbers,"34 Moore Rd, Yaba 101245, Lagos, Nigeria, Lagos, Lagos State",3.37768411636353,6.51466608047485,1ecafa05-cde7-4019-a822-a484a40346e7,6
De - Best Barber's Salon,"Ogunnaike St, Dopemu 102212, Lagos, Nigeria, Lagos, Lagos State",3.36883330345154,6.54047727584839,adcb4868-9fb8-4597-9310-c315e410e9aa,3
Royalty's Hair Dressing Salon,"26 Alara Street, Onike, Yaba, Lagos, Nigeria, Lagos, Lagos State",3.38092541694641,6.50608587265015,ce2d3d1d-341b-4b53-ac28-682b15537f48,4
Morufat Abdulraheem Salon,"3 Olaleye St, Ojo 105102, Lagos, Nigeria, Lagos, Lagos State",3.37277793884277,6.53589916229248,7162a5f1-8f3d-4f36-ac4c-b9871f62dcd3,3
FUAD Barbershop,"BARRACKS B/STOP, 60 Tejuosho Rd, Surulere 101241, Lagos, Nigeria, Lagos, Lagos State",3.36951661109924,6.50406742095947,6aa74463-8c1c-42e8-95c0-80d7d73f44d8,4
LEX BARBER SHOP,"32 Diya St, Gbagada 100242, Lagos, Nigeria, Lagos, Lagos State",3.3950879573822,6.54734802246094,2889a8cf-c1c7-4ccf-865b-fa204c13ed4e,6
Ogunwe Hair Salon,"1 SHOLADEMI STREET, Alimosho 102213, Lagos, Nigeria, Lagos, Lagos State",3.40629816055298,6.55196142196655,d032efa8-24e3-436d-8332-b8ff234d61be,5
Seyi Bakare Styles,"31 APENA STR S/LERE, Ojo, Lagos, Nigeria, Lagos, Lagos State",3.36176347732544,6.51425313949585,f8d78585-d642-4aaa-b300-5eeaa7b676a0,3
UCHE BEST BARBING SALON,"2 , Ikunna Street, off Liasu Rd, Egbe 300001, Lagos, Nigeria, Lagos, Lagos State +234",3.34343028068543,6.49942111968994,c637a295-114e-4014-a5dc-f28b0f7767d1,8
THE PRISTINE BARBERS,"Benson Street, LAGOS, Lagos",3.35908651351929,6.50466728210449,400f8d19-a5e0-4fad-9de5-fb26b02ed0af,7
Autograph Barbing Suite,"No 44 Ikosi road, Ikosi Road Shopping Mall, Ikosi Ketu, Lagos,23401, Lagos, Lagos",3.39582991600037,6.45306015014648,77423a83-2cbc-4ebb-92ce-8551472a9cce,8
Ifeoluwa Barber Shop,"11 Wuraola St, Shogunle 102214, Lagos, Nigeria, Lagos, Lagos State",3.34163498878479,6.51243495941162,c7749044-7be5-40ea-9681-f2555f0528e3,1
Kazeem Mehmud Salon,"128 Agege Motor Rd, Mushin 102215, Lagos, Nigeria, Lagos, Lagos State",3.36000466346741,6.52562093734741,575889a7-1ddf-4362-bdac-ceecce59b407,3
Tosin Olumide Salon,"96 Olateju St, Mushin 102215, Lagos, Nigeria, Mushin, Lagos State",3.36035585403442,6.53180980682373,40f3c470-2ac4-43ec-aa2d-b6607e1e81a0,5
Priscilla Lady's Salon,"MILE 12, 10, OMODUNNI STREET, Ikosi Street, Isheri, Lagos, Nigeria, Lagos, Lagos State +234",3.34265971183777,6.51051330566406,e3886c12-bcda-4629-90c8-686fe93b5a48,1
