Name,Address,Longitude,Latitude,id,Qualification
HITECH ELECTRO MECHANICAL COMPANY LIMITED,"11 Little Road, Lagos, Lagos 1012012",3.37674999237061,6.51046705245972,4223e2f4-86cf-4505-939b-095ef49a1932,10
THREE E. ENERGY LIMITED,"Plot 1221, Ahmadu Bello Way, Victoria Island, Lagos",3.3609778881073,6.51490688323975,6422717b-ebbf-4b5e-9007-ac7920a12eec,9
Elektrint (Nig.) Ltd,"Plot 11 Gbagada Indl. Estate,Gbagada-Oworonshoki Exp-Way, LAGOS",3.36832308769226,6.51110935211182,4c0fd005-47e5-4a06-8c7c-7a1d05821e91,8
Bairstows Energy Limited (0700Inverters),"Anthony 105102, Ikeja, Nigeria, Ikeja, Lagos State",3.36755728721619,6.55932188034058,087c01b9-77b0-4219-82f7-4b4620d9848d,4
WC NIG LTD,"12 Taiwo Street, Lagos, Lagos State",3.3302435874939,6.51957273483276,2af17637-26a9-4ebf-8d5e-40b51a4e9ce1,2
ZAAPTRON LIMITED,"3, Aderibigbe Street, Lagos, Ogun",3.34600210189819,6.50411796569824,5cc2271e-fbbc-4f90-b8f0-a28ee1d57030,4
CCL,"73, Oshodi Street, Oshodi, Lagos",3.34134292602539,6.55658006668091,a3b4bf27-28db-4dd8-b082-9058b11e4843,9
ARIES,"2, Dalgo Drive, Awuse Estate, LAGOS, Oyo 100281",3.34144139289856,6.53280019760132,5f9922d8-ea36-4de0-9a51-1ed2ea5fe29d,4
SCANPOWER LIMITED,"12, Obanikoro Street, Lagos, Lagos",3.36930394172668,6.54792499542236,297b9b02-3734-4a46-a263-f61c6af7ed16,2
ISOLO POWER GENERATION LIMITED,"110/114, Apapa Oshodi Expressway, Lagos, Lagos",3.34267997741699,6.55629014968872,3cd8aa14-6128-4bf4-b57e-57a4444ff078,7
SYSTEMS INTELLIGENZ,"35B Shittu Animashaun Street, LAGOS, Lagos",3.38347816467285,6.54474639892578,216f4f53-2ea8-4fe5-a501-74e83fe4309d,10
Quintus Projects Ltd,"20 Agberinstreet, Oworoshoki, 101001, Lagos, Nigeria, Lagos, Lagos State 101001",3.39921975135803,6.55695533752441,8197d88c-7c81-41f2-9a22-ef9ca26f0f39,10
Rotary Engineering Nigeria Ltd.,"6 Karimu Ikotun St., Victoria Island Lagos, Lagos, Lagos",3.38138508796692,6.50442600250244,b667620d-f013-43eb-a38a-2ab8db318afd,7
Latson Azeez Technical Supply Company Ltd.,"Plot 10 Onipetesi Ind. Est., Mangoro Bus-stop, Agege Lagos, LAGOS",3.36226081848145,6.52388000488281,e56fe6dd-2c82-4b36-b5bd-0b1ca3751c1c,2
Ani-one electrical enterprises,"24B Isaac okommor street ogudu Lagos 63 Agboyi Road,Alapere Ketu Head office: 24b Isaac okommor street ogudu ,Lagos ,Nigeria Kosofe local government lagos, Lagos, Nigeria, Lagos, Lagos State",3.39052677154541,6.57500076293945,97df8903-07ac-4d64-bc6e-0becf6ec3314,8
DISL,"18A Cooper Road, LAGOS, Lagos 106104",3.36173462867737,6.54921531677246,0d492426-e813-4534-a720-02aa8203fb0f,5
LFTZ MAYOK ENGINEERING LTD,"16/18, Alufa Aminu Street, Lagos, Lagos",3.37019991874695,6.54445600509644,02482166-11de-49f6-8c7e-72ba40ce746f,4
CHRONICLES INTEGRATED SERVICES LIMITED,"8 Ajayi Street, Maryland, Lagos, Ogun",3.37676000595093,6.57036018371582,c217b76e-f03b-4ac6-a3a1-1013c73cdf7b,7
Lord mart Nigeria Ltd.,"9A Karimu Ikotun St., Victoria Island Lagos., Lagos, Lagos",3.38138508796692,6.50442600250244,fc060874-0ba3-4a50-9810-fea1969d123a,10
Mic Bab Nig.Ltd,"9 ILUDUN STREET' AMUKOKO APAPA LAGOS NIGERIA., Lagos, Lagos",3.39505195617676,6.54901218414307,a630c6aa-cd26-4236-85de-516681070287,10
DC CONTROL LIMITED,"350/360 Ikoro Suite Bc12, LAGOS",3.36682939529419,6.56735181808472,30e61752-54a6-439b-810d-a1bae2b7d253,7
SOLOGENTLE ELECTRICAL WORKS ®,"22 Akinola St, Bariga, Lagos, Nigeria, Lagos, Lagos State",3.38783955574036,6.5387544631958,0049ed10-7755-40b9-aed9-e581501b7e5a,6
EGBIN,"Egbin Power Station, LAGOS, Lagos",3.3866229057312,6.53572988510132,e2894258-7e19-4884-b9b5-bd352b071cdc,3
GOtech electrical engineering,"Yaba Local government, 75 Queen street alogomeji sabo yaba, Yaba, Lagos, Nigeria, Lagos, Lagos State",3.3817834854126,6.49078226089478,8f5f65a8-707d-4da9-a025-4b3ccf771107,6
Transez Nigeria Limited,"Chief Sunday Ogunyade Street 5, Lagos, On 100234",3.39091897010803,6.54788494110107,f26fe66b-57f1-4cb5-b074-b79c408671c7,4
ENGINEERING & TECHNICAL COMPANY LIMITED,"14 Creek Road, Lagos, Lagos",3.38381099700928,6.53524017333984,e7a90b67-2629-4f6f-bc5c-49b99e778447,8
STARSIGHT POWER UTILITY LIMITED,"9 Ondo Street, Ikoyi, Lagos",3.42837595939636,6.46347570419312,ec3f745b-fa72-4b48-b950-e670b84600da,2
Eletrik Planet Limited,"17 Basheer Augusto St, Surulere 101241, Lagos, Nigeria, Lagos, Lagos State",3.3589391708374,6.49052715301514,d6b345d2-8ba3-414d-810d-16305a53d1a4,9
3Akt Communication And Security System,"Arab Rd, Abule ijesha 101245, Lagos, Nigeria, Lagos, Lagos State",3.37939453125,6.52364349365234,50a220dd-3671-44a3-acac-f08fb5d648b5,9
EASTMAN POWER SOLUTIONS LIMITED,"Carter street, LAGOS, Lagos",3.38332509994507,6.49122476577759,6e6f6437-a49a-4315-890f-63a6faaa9d99,6
BFJX General Contract,"New Makoko, Sabo, 24 Falodu St, Lagos Mainland 101245, Lagos, Nigeria, Lagos, Lagos State",3.38671398162842,6.50162649154663,5b1d88bc-133e-410d-b330-bb2a5aa34e58,4
EAI ENGINEERING SERVICES LIMITED,"12 Oweh Street, Lagos, Lagos",3.37069606781006,6.5217170715332,52c11c78-0658-4a30-a0f7-995842fa4b17,8
BATUL ELECTRIC ENERGY LTD,"Lekki Phase1 Omorinre Johnson street, Lekki, Lagos",3.39581036567688,6.45300769805908,e2240bf6-43d6-41cf-b84f-4f21c628b823,1
Bashiru Plumbing & Electrical Engineering Services,"Lagos 82, GLOVER STREET EBUTE-METTA LAGOS Nigeria, Lagos,100001, Lagos, Lagos",3.39722681045532,6.45205116271973,0d2d80c9-fc8e-4ead-8b70-a5fa5c898786,8
Leventis Power Systems,"8 Ijora Causeway, Ijora, Ijora Lagos., Lagos, Lagos",3.37073802947998,6.46897697448731,a3a03208-b13c-4917-8b26-a5d508e80c51,10
KENILY SERVICES LIMITED,"911 Sunday Ogunyade Street, Gbagada, Lagos",3.38989591598511,6.54754257202148,616540d3-56c5-41c2-bad9-c23942555b39,4
GODSPOWER ELECTRICAL,"1 Chief Natufe Street, Iganmu 101241, Lagos, Nigeria, Lagos, Lagos State",3.34623265266418,6.48736572265625,abb1f012-219b-493a-9d0f-5a120fa11f74,9
BOAB ENGINEERING SERVICES LIMITED,"17 Little Road, Yaba, Lagos",3.38151931762695,6.49141263961792,6ad4e812-ffdc-4331-9a81-59436fbfa8e5,7
TESLA,"10A Fatai Anjorin Street, LAGOS, Lagos",3.3824200630188,6.54569005966187,053f7217-6a20-4191-8e7a-e1d7a41c5d2f,7
Niyibram Communication Servicers,"NO 35 TURNER STREET MOSAFEJO AMUKOKO APAPA LAGOS STATE NIGERIA, Lagos, Lagos",3.38619995117188,6.51218986511231,2c1af28f-dae3-4ed1-be0c-e2b2c9bf20d7,2
Bodge Limited,"64 Falolu Rd, Surulere, Lagos 101241, Lagos, Nigeria, Lagos, Lagos State",3.35406541824341,6.50818204879761,45608ab7-1d5f-42cd-82bb-cd59949b9969,4
FEGMATECH COMMUNICATIONS LTD,"94 Shyllon Street, Lagos, Lagos",3.36505508422852,6.53958511352539,3215b90b-0908-4b95-8ca0-07a67cf48fb4,5
Kontri Limited,"17, Association Avenue, Ilupeju, Lagos",3.36324167251587,6.54781723022461,768901b6-cc8f-4bad-8db8-3f79aa9533bf,3
Mane Ltd.,"Plot 5 Block K, Oshodi Expressway Opp African Concord,, LAGOS",3.34339904785156,6.51250791549683,355fb118-825e-4952-8b85-c71891a2bafe,4
URBANELECTRICFIX CONSTRUCTION POWER ENGINEERING ENTREPRISE,"2 Basheer Augusto Street, LAGOS, Lagos",3.36005687713623,6.4898362159729,871da3c3-6980-43d3-b914-810a64f225b5,9
Power Systems Techno. Ltd,"148/150. Bode Thomas Street, Eric Manuel Bus Stop, Lagos",3.35442709922791,6.49013900756836,fb129353-ae54-4338-bcd5-5a470d97b368,10
Dtech Nigeria limited,"10 temidere street, Oko-Oba Rd, Agege, Lagos, Nigeria, Lagos, Lagos State",3.34144258499146,6.51062536239624,da89410d-3a6e-4d24-8473-967610aa18e7,6
Lightietech Limited,"4a Abule Nla Rd, Ebute Metta 100211, Lagos, Nigeria, Lagos, Lagos State",3.37004399299622,6.48490333557129,171bc6d2-fef6-4d83-a7dc-0b5f3ce163e1,3
Rewinding & Technical Services Ltd,"2/3 Eric Moore Rd., Iganmu Lagos., Lagos, Lagos",3.35534000396729,6.48648500442505,ddfe0ba1-6e42-43e1-856c-b1a6900fdabc,10
Mayoks Integrated Engineering Services,"15 Makurdi Street, off Ojoniyun Street, Lagos, Lagos 101211",3.37419700622559,6.48841619491577,85b860d7-8247-492f-9db2-0481719f1c49,7
AETI POWER SYSTEMS AND CONTROLS LIMITED,"Bode Thomas Street, Surulere, Lagos",3.35443544387817,6.49011516571045,138f9369-9b55-42a3-a07d-e33ebcac1635,3
SCHNEIDER ELECTRIC,"3A Cocoa Industrial Road, LAGOS, Lagos 101233",3.32430744171143,6.44611263275147,ef9a471f-466d-4972-bed1-cbf6f0bddf25,7
ADISCO NIGERIA ENTERPRISES LIMITED,"79, Sari-Iganmu Road, Lagos, Lagos",3.34598898887634,6.47763395309448,b7b76117-b51f-47fb-8f6f-d0c2cf25d019,1
WELBECK ELECTRICITY DISTRIBUTION LIMITED,"Plot 9 Gabriel Olusanya Street, Lagos, Lagos",3.30069804191589,6.5366849899292,6c6ea44b-f60d-4c18-b47b-0990c9fd4adf,10
GRACEAFRIC ENGINEERING NIG LTD,"44 Godwin Omoruo Way, Isolo, Lagos",3.32504200935364,6.52125835418701,8a0ade94-bcc9-47b3-8b00-59760f1750a5,10
SAFEWEST ELECTRICALSERVICES,"No. 7 Oriyomi street ikeja Second Floor IKEJA LGA, 100212, Lagos, Nigeria, Lagos, Lagos State",3.34630584716797,6.5963249206543,1d846a42-a490-45fa-90d3-80a316f6bc12,10
Stepheria Electrical/ Plumbing Limited,"29 Jamiu Eletu St, Awoyaya 105101, Lagos, Nigeria, Dongo, Lagos State",3.30627369880676,6.49475860595703,a4672711-950b-41c2-8ee5-a6804ba559dc,1
BABO Smart Solar system,"20 Atiba Osborne St, Mende 100011, Lagos, Nigeria, Lagos, Lagos State",3.37474203109741,6.57168960571289,36195b66-c9c4-4df6-a28d-4fa807706ba1,7
Mane Limited,"Plot 4, Block K, Apapa Oshodi Expressway, Lagos, Lagos, Lagos",3.32565069198608,6.48735427856445,9f32ae6f-1af7-490c-a5f9-f45e4a32a09a,1
JPC SAT COMMS,"Ago- Owu St, Fadeyi 102215, Lagos, Nigeria, Lagos, Lagos State",3.34236216545105,6.5761284828186,7c4270fa-f2dc-4100-ae0e-0bc082600193,4
SKEIN NIGERIA LIMITED,"2 Amosu Street Boda, Lagos, Lagos",3.35108995437622,6.48803997039795,22ec71a9-b338-45d0-9630-6b3a0326bbe8,9
E. O. A Technical Works,"18 Aina Rd, Oshodi-Isolo, Lagos 102214, Lagos, Nigeria, Lagos, Lagos State",3.32280611991882,6.52605152130127,828ba2ee-b177-4962-b549-94453a4b34f0,2
MOJEC METER COMPANY,"244-246, Oshodi-Apapa, Expressway, LAGOS, Lagos 100001",3.32567000389099,6.48733997344971,9785f9dd-5a78-4c48-8d18-0ac52a62b6a0,8
RIGGER VICNK LIMITED,"16 Rafiu Shittu Street, Lagos, Lagos",3.32507991790772,6.50137996673584,b7c366d3-7dfb-4af0-93f9-ea9253a8d866,7
EKEDP,"24/25 Marina Road, LAGOS, Lagos",3.38295102119446,6.45524311065674,627eb9b1-4261-4299-af98-55e7afd3361f,8
BOT ENGINEERING CO LTD,"435/437 Herbert Macaulay Street, Lagos, Lagos",3.38662004470825,6.48143005371094,879f53b4-ea2e-4564-8018-cea114a600e1,5
GENESIS ENERGY HOLDING,"Plot 9, Layi Ajayi Bembe Street, LAGOS, Lagos",3.38984799385071,6.46179914474487,e7e2374d-cf9d-473a-b4a5-65ef7b67d248,5
TNL,"45A, Campbell Street, Lagos, Lagos",3.39314889907837,6.45187616348267,cd63b13a-7607-4c04-90af-e180b54cbdd9,2
A-N Nnamani Enterprises Co. Ltd.,"Block 19, 35 Ojo Alaba International Market, Lagos State, Lagos",3.41507649421692,6.45699119567871,9f21bcfc-3999-47a0-9e38-f212f27c5566,1
TOPDEL ENGINEERING LIMITED,"35A, Adebayo Doherty Street, Lekki",3.46411633491516,6.44216442108154,f41ba6ac-1bba-43ba-baee-8b0b1bc7deb9,10
BID-PO,"Plot 27B, Block 68 Bisola Durosinmi-Etti Drive, LAGOS",3.47457432746887,6.43707180023193,a6188f9c-e1d8-427a-b801-52caf1795f85,10
AITEO,"1 Admiralty way,, Lekki, Lagos 105102",3.46174478530884,6.44688415527344,25b4b66f-a7b6-4da6-9a0c-17e513499969,7
CHRISTOJAS NIGERIA LIMITED,"No 5, Emma Abimbola Street, LAGOS, Lagos 234001",3.47369337081909,6.44263029098511,0d8c2fae-008c-47ea-b52d-85a9ba9a7efc,7
ACCELERATED COMPACT ENERGY SOLUTIONS LIMITED,"24b Babatunde Anjous Street Off Admiralty Way, Lagos, Lagos",3.45536494255066,6.43639516830444,3c3fa0f4-dd93-4c25-ba51-5db598cf8bda,3
STRATAGEM ENERGY MANAGEMENT LIMITED,"NIGERIA, Lagos, Lagos",3.44272494316101,6.45934295654297,07169b29-85d1-4cfc-a8a7-24a5bcce0229,5
CBC,"CBC Towers 10/11 Olubunmi Owa Street, LAGOS, Lagos 105102",3.47103500366211,6.44766521453857,a5e345ec-e998-4673-8f5e-f9d5999cb0ce,3
RICH KAY INVESTMENT SERVICES LIMITED,"Block 3 Flat 2 Sotubo Estate, Ogun State 220101",3.45594382286072,6.43934297561646,13223df6-2f61-488d-a9b1-c5dde8a6b903,2
PETROFAC ENERGY SERVICES NIGERIA LIMITED,"Muri Okunola Street, Plot. 252E, Lagos, Lagos",3.44158697128296,6.4343409538269,d9e359d0-0bd2-4a0b-a80d-3c532621a265,10
PRIVIDA,"Lekki Phase I 7, TF Kuboye Street, LAGOS, Lagos",3.45998001098633,6.43483018875122,c9043b3b-ea31-4bcc-b1cf-f14561d2e3ed,2
Fredd Ogbe Electrical Works,"13/14, Karimu Kotun Street, Victoria Island, Lagos., Lagos, Lagos",3.42563009262085,6.42899990081787,d40cd22f-c45a-4aa3-8421-babc878c69fa,3
CRESTFLOW ENERGY LTD,"B1, Silicone Estate, Admiralty Home, Tourism Road, LAGOS",3.4701099395752,6.44904565811157,e2b8f48f-22ad-4160-b860-8c1b0be45cb2,8
KLARTEK NIGERIA LIMITED,"19 Adeola Hopewell Street, Victoria Island, Lagos",3.42649507522583,6.43758296966553,8afc56e0-3c86-41ca-9a8a-2f1efea7ce7c,1
EnergyAfric,"39 Alfred Rewane Road, Lagos, Lagos State",3.42978096008301,6.45138692855835,8c85fbdc-6faa-43d6-a035-94ac315c1f9a,9
METRIX,"PLOT 323 Akin Ogunlewe Rd, Victoria Island 106104, Lagos, Nigeria, Lagos, Lagos State",3.43771743774414,6.42594528198242,36c7e368-cc08-4b96-8147-f2ccd56ecbe6,3
Benel Energy Resources,"Plot 6b, Olajide George Street, Lekki Phase 1, Lagos 105102",3.46142530441284,6.44576072692871,443071ef-3edc-44e1-978c-7af4931d46f8,3
Halliburton Energy Services Nig. Ltd.,"Plot 90, Ajose Adeogun Street, LAGOS, Lagos 101241",3.43755698204041,6.43089008331299,82eacc03-27d2-440d-a6ed-f2a9a0ef736c,9
MAIN ONE,"Ligali Ayorinde Street 3b, Lagos, Lagos State 23401",3.43944358825684,6.43452405929565,4a101690-4571-4e06-8e36-128eefaf50e9,3
AIPEC OIL AND GAS LIMITED,"Nigerian Law School Lagos , 10Th Floor, The King'S Court,Off Ad, LAGOS",3.48520398139954,6.4495644569397,429f4274-348a-4da8-8a43-1fc37baf9129,5
SAHARA GROUP,"7a Fowler Road, Ikoyi, Lagos, Lagos",3.43096303939819,6.45176410675049,d76b1b98-e63c-41d7-8c62-951a7643ef04,7
QUI VENTURES LIMITED,"Plot 8, Qmb Building Block 138 Lekki Expressway Phase 1, LAGOS",3.4612090587616,6.4313063621521,6a6798fd-2e2f-4368-b68b-ba4174d3d9ff,8
SERL,"7A, Oluwa Road, LAGOS, Lagos",3.43087792396545,6.4515380859375,4635d6e6-b0d5-4284-ba29-6a143114b002,7
DESICON ENGINEERING LIMITED,"6B Oko-Awo Street, LAGOS, Lagos",3.42771601676941,6.42859506607056,d89abafa-9ce7-4994-a84d-0f52802389c2,6
DALEX NIGERIA ENTERPRISES,"Opposite Forever Living Produc, 26, Aromire, LAGOS",3.43179249763489,6.45296669006348,96e69750-8ecb-4cb4-be9a-8ac25cbb40f9,5
RENNICS TECHNO LTD,"85, TRANSIT VILLAGE, 5, Adetokunbo Ademola Street, Victoria Island, Lagos, Nigeria, Lagos, Lagos State",3.4295916557312,6.42769622802734,9701f15a-8f3e-41e4-9afd-68ac1ab30fea,2
Mason Generators Ltd.,"269A Jide Oki St., V/I Annex, Victoria Island Lagos, Lagos, Lagos",3.43935489654541,6.42677879333496,3fe069a8-64b3-4f0d-ac2a-0cefdc5c3cb1,5
WEST POWER & GAS LIMITED,"15 Adetokunbo Ademola Street, Lagos, Lagos",3.42994499206543,6.42987012863159,2e7750f9-39fb-4d1a-a8c4-eada876d7990,3
SOLAD INTEGRATED POWER SOLUTIONS LIMITED,"21A, Olosa Street, Victoria Island, Lagos, Lagos, Lagos, Lagos",3.42887997627258,6.42760515213013,2e38ed11-1e00-4803-9aeb-bc53374c249a,1
DCC SATELLITE SERVICES LIMITED,"Castle Building (DCC) Adebayo Doherty Road, Off Admiralty Way, Lekki, Lagos 23401",3.45544481277466,6.43631267547607,b726c00e-273d-476c-92ed-7bf19e1ce6b7,3
ELECTRIC SHACK LIMITED,"Sleek Studio Shop 2,141 Ahmadu Bello Way,, Victoria Island, Lagos",3.40932607650757,6.42825889587402,f234e708-03d5-4b86-8a7d-c2f7c433af21,10
Proton Energy Limited,"Lekki - Ikoyi Toll Bridge, 24 Idejo Street, Victoria Island, Lagos 101241",3.41302919387817,6.42626571655273,75d07c67-9227-499f-b23d-dd123e1d30ee,5
Elektron Energy,"8 A Gabaro Close, LAGOS, Lagos",3.41876888275147,6.42610216140747,22a46ef3-02eb-46b1-8ce7-4dfa745d5d3f,5
ARNERGY SOLAR LIMITED,"22a Adeleke Adedoyin St, Victoria Island, Lagos, Nigeria, Lagos, Lagos State 101241",3.41777610778809,6.43337821960449,8630c683-af7c-4b4f-8829-a0c8e7f9c090,5
Geregu,"13 Walter Carrington Crescent, LAGOS, Lagos 1024",3.40833401679993,6.44008111953735,25cb6132-0a19-4f79-b030-957ab5252157,4
TELVIDA INTERNATIONAL SYSTEMS LTD,"PC 12 Churchgate St, Victoria Island 106104, Lagos, Nigeria, Lagos, Lagos State",3.41585803031921,6.4312858581543,c5e2f8fd-e22c-490b-8b87-5c7d59b4e9bc,7
OANDO CLEAN ENERGY,"Wings Office Complex 17A, Ozumba Mbadiwe Avenue, Victoria Island, Lagos",3.40920233726501,6.43801975250244,0b59918c-2f88-4bec-8602-ea8e1751c8da,2
Powercrest Nigeria Limited,"South West, 15 Keffi St, Ikoyi, Lagos, Nigeria, Lagos, Lagos State",3.41506433486938,6.44845104217529,6b5b1c66-8a4f-474e-97e2-a0b336df2f99,7
TOPSTORES ELECTRONIC CO LTD,"P O Box 4170, Marina 3rd Floor, Lagos, Lagos",3.40568995475769,6.45120000839233,c54087a7-11c3-43b8-9986-097c53c634a5,5
SUB-SAHARA GAS AND ELECTRICITY CORPORATION LTD,"St Nicolas House 6, Catholic Mission Street, Lagos, Lagos",3.39842009544373,6.44949007034302,b8742fc1-25d0-42dc-b633-2536b5b8e159,5
DOCTOR VOLKS AUTO ELECTRICIAN,"Association Avenue, Odo, Lagos",3.31191062927246,6.53738451004028,4dd1284f-4a2f-4f0b-a5f4-be5c35039777,8
WESTERNEDGE,"Monarch Plaza 65C Opebi road, Lagos, Ogun",3.35536289215088,6.59552478790283,424e52ca-81b4-43ae-936b-4b9ee3335f7d,2
POWERWORX LIMITED,"27, Ladoke Akintola Street, LAGOS, Lagos",3.35152006149292,6.58372211456299,24d3b520-4eb2-4668-9c36-e62b4dc60fc5,1
Jonac Engineering Plant Nigeria,"Plot 24 Kudirat Abiola Way Former Oregun Road, Oregun, Lagos, Ogun",3.37330794334412,6.59198808670044,7fbccb7b-bc74-4f0b-86f6-6d1232888d1e,8
D Law Auto Electrician,"Plot 10,Oluwa Akerele street off Obafemi awolowo way balogun b/stop Ikeja, Ikeja 300001, Nigeria, Ikeja, Lagos State",3.33997917175293,6.59647989273071,a1e36d31-d1bc-412c-b27a-76739e5a7942,10
DELAW AUTOMOBILE ELECTRICIAN,"Obafemi Awolowoway, Ikeja, Lagos",3.3405978679657,6.59685659408569,736b5fb5-f2ac-4fdf-85d3-bb2fda97c282,2
Jubaili Bros Engineering,"Ikosi Road 2, Ikeja, Lagos State 101233",3.37496495246887,6.59946823120117,e784c712-7f8f-4d07-a0db-8d143e15bd8e,9
ARIUS INTEGRATED ENERGY SERVICES LTD,"N0 2 Allen Avenue, Opposite Toyin, Lagos",3.35213994979858,6.60143995285034,832c6b9d-66dc-42e8-b815-122d6129a29a,8
EDUBEKE ELECTRICAL CONTRACTOR,"5 Asejere St, Ijegun 102213, Lagos, Nigeria, Lagos, Lagos State",3.32994055747986,6.62281131744385,0e189ead-c443-4d9b-beba-64618f540200,9
AGGREKO PROJECTS LIMITED,"No. 8 Tokunbo Alli, off Toyin Street, Ikeja, Lagos., Ikeja",3.37244892120361,6.6034951210022,827a8a93-9d05-48d5-a669-0bd1f8f0014e,8
KABITEX INDUSTRIES LTD,"P O Box 2149, Re-insurance, 9th Floor, LAGOS",3.36544179916382,6.56796073913574,66611bff-8706-4715-9f11-39f125ff9c28,4
Schneider Electric,"Adeniyi Jones, Tunde Gafar Close 1, Lagos, Ogun",3.34550905227661,6.61202716827393,713da6db-9a9b-4845-9884-94e71945d5db,5
HTIL,"Ajao Estate, 24 Olakunle Selesi Cresent, LAGOS, Lagos",3.38931608200073,6.6323299407959,94a4da86-364f-44dc-8000-054292e7e0b6,2
DEXTER GLOBAL PROJECTS LTD,"House 2, Abiola Court 5, Chevron Drive, LAGOS, Lagos 23401",3.35511994361877,6.61377000808716,875c7e25-2159-4868-a5db-e0efa81d941c,6
Saheed Electrical Engineer,"7 Akilo Rd, Ogba 102212, Lagos, Nigeria, Lagos, Lagos State",3.33499503135681,6.62451648712158,434d251e-7637-4970-9a08-a8e0b15f1784,2
ASHIPA ELECTRIC LIMITED,"30 Oremeji Street, Off Coker Rd, Ilupeju, Lagos, Nigeria, Lagos, Lagos State",3.33421039581299,6.62350988388062,b6e409da-dc56-4903-8f35-56131fb588eb,9
ABB,"4 Metalbox Rd, Ogba 101233, Ikeja, Lagos, Nigeria, Ikeja, Lagos State",3.34222984313965,6.62514925003052,d2f43e92-799e-4339-8ff6-a8fdb2ce8d20,5
Sollatek Nigeria Ltd.,"Jagal House, Jagal Rd., Oregun Ind. Estate, Oregun - Ikeja Lagos, Lagos, Ogun",3.35480809211731,6.61583995819092,a398f8c9-39c5-4ceb-8566-91fd7930791d,10
SENL,"1, Tunde Gafar Close, Ikeja, Lagos",3.34550905227661,6.61202716827393,7f6063e6-8936-4762-a99d-5f341509716f,10
Hicon Global Projects Ltd,"18 Thomas Salako Street, Lagos, Lagos State",3.33923649787903,6.6341872215271,38fcead2-4345-40e7-b253-4a31fb08d27b,4
Seacof Engineering Service,"2, Muyiwa Close, Lagos, Ogun",3.34256601333618,6.63666820526123,9ab79742-0dc6-4ef0-8c3d-5c27381abedd,7
CEN Corustar Limited,"8 Alade Ave, Allen 101233, Ikeja, Nigeria, Ikeja, Lagos State",3.34744501113892,6.60509252548218,3b594fcd-2d77-4418-bddd-5c3bc36af75e,7
ADID ELECTRICAL ENGINEERING COMPANY LIMITED,"94, Palm Avenue, Lagos, Ogun",3.36103200912476,6.62443590164185,e859dd0c-9d5b-41ed-95ad-194a91cdb7e3,9
Pivot Engineering Company Ltd.,"Pivot House, 6A Acme Rd., Ogba, Ikeja Lagos., LAGOS",3.34415078163147,6.62522649765015,d69b7c35-5875-4324-8bce-f008c682ab10,4
EIYE JERRYS (NIGERIA) LIMITED,"8, Alade Avenue, Ikeja, Lagos",3.34744000434876,6.60510587692261,faf62a71-3749-4d46-8075-28f6b2218a3d,3
TEMPLE TELECOMMUNICATIONS LTD,"115,Adeniyi Jone Avenue, Lagos, Ogun 23401",3.34412598609924,6.60965490341187,e2113547-f915-4547-975c-5d9f3522503f,3
KANFE OLUWANISOLA & COMPANY LIMITED,"2, Lekan Solanke Close, Lagos, Ogun",3.34940004348755,6.6108889579773,9a46ff49-6448-4ba3-a31a-124b5c33e39e,6
NIGERCHIN ELECTRICAL DEVELOPMENT COMPANY,"Plot 1 Ayodele Diyan Road, Lagos, Ogun",3.38690495491028,6.6054801940918,e3c4dbe0-d304-4942-88da-74b44d5e5762,3
ESE-TECH NIGERIA LIMITED,"18, Alhaji Kosoko Street, Lagos, Ogun 100213",3.36910510063171,6.64452981948853,caac2b9e-503c-45c1-9f45-ed96504783d3,1
SULECTRICS ENGINEERING LIMITED,"No.9 Solomon Avenue, Lagos, Ogun",3.37686896324158,6.6344780921936,59214b7e-0324-4dd6-b525-60cf039f4ab7,3
POWEREX LTD,"Elephant Cement House Assbifi Road, Lagos, Ogun",3.35707497596741,6.61540508270264,966a5ce7-ae32-4541-b658-5450f3888c6e,5
Eoladele Designs & company Engineering/construction,"santos avenue, Lagos,23401, Lagos, Ogun",3.30611348152161,6.65349817276001,05111e0e-c006-4d20-a5b4-96c94410adec,7
Dawnlight electrical services,"112 Nureni Yusuf Rd, Alakuko 101232, Lagos, Nigeria, Lagos, Lagos State",3.2798764705658,6.67967796325684,5abc17a3-bc6a-43f0-9b90-f9587e1707e1,6
Accretive Technology,"154 Iju Ishaga Rd, Ifako Agege 101232, Lagos, Nigeria, Iju, Ogun State",3.30831599235535,6.68304586410523,93e02328-e27a-4249-8950-ece52695899a,8
INTERLINK,"50B, Oladipo Bateye Street, LAGOS, Lagos",3.31447792053223,6.64162492752075,c74c73f0-7ec9-468d-a237-0fb24ec8a6fb,9
Clarke Energy (Nigeria) Limited,"Joel Ogunnaike Street, Ikeja, Lagos State",3.31108403205872,6.61447811126709,fbfc97c1-48ca-49d7-93ce-71a96b8e3f33,4
MBH POWER & GAS LTD,"Opp. Boulos Nig Enterprise, No. 12, Acme Road, LAGOS, Lagos",3.34988212585449,6.62770509719849,33f545fb-3dd5-467a-a8be-5d209b03ebb1,6
LE CHRIS DEVINE ELECTRICAL NIGERIA LIMITED,"48, Victor Fagbemi, off Aboru - Abesan Link Brg, Street, Lagos, Nigeria, Lagos, Lagos State",3.28588342666626,6.62698936462402,7fae5580-da79-4a2f-90e8-33ee3d953069,4
Lowa Electrical&Engineering works.,"Along lasu iyanaiba way,igando Lagos., Lagos,+2348134794137, Lagos, Lagos",3.26255011558533,6.61420726776123,c542997a-d673-408b-9319-e529b46f7db4,8
Horeb High Endeavours Generator Services,"28, Olaniyi Street, Ladikai, Somolu, Lagos, Lagos, Ogun",3.30591011047363,6.67273378372192,343407ec-f05e-498b-92b2-bd120d267f7c,3
SOLAR ENERGY AND POWER TRANSFORMERS NIGERIA LIMITED,"Igboko-Nla, Pipeline Road, OGUN STATE",3.29640889167786,6.6427001953125,700c7e30-86b0-47db-9816-815c14bec416,3
ELTEM SUPPORT & SERVICES LIMITED,"Suite 310, Betta Building No 9-11, Coker Street, Lagos State, Lagos",3.30908894538879,6.6268482208252,9cf70fcc-f525-429b-8bd8-7db95b99efa2,1
K.C Kandy Enterprises,"1, Anuoluwapo Street, Ilasamaja, Lagos, Lagos, Ogun",3.31563997268677,6.62762689590454,45860867-2f89-4148-9fea-ba40430c811d,9
Distinctlink Electric Ltd,"8 Madorf Court, Agodogba Ave, Parkview Estate 101233, Lagos, Nigeria, Lagos, Lagos State 101233",3.43786644935608,6.45857000350952,9de74ec8-ac6c-43ea-b773-186be46c317f,7
Electrician,"Nigeria, Ibadan, Oyo 20002",3.896399974823,7.38780021667481,296052b3-64b0-4e69-affa-585dc6533d49,3
Excellent electrical engineering,"28, lolubank street,Anisere ipamesan,joju bus stop, Sango 112242, Ogun State, Nigeria, Sango Otta, Ogun State 112261",3.43892931938171,6.97885799407959,357d1978-de1f-4020-a2fa-d3df5bea9b3a,3
STEPHEN SPARK ELECTRICIAN,"Agbowo Shopping Complex, Ibadan, Oyo",3.91714596748352,7.3960747718811,40e33eda-64a9-43b7-b5e7-6e547ede8312,1
IBADAN ELECTRICITY DISTRIBUTION COMPANY (IBEDC) PLC,"Capital Bulding, 115 Ring Road, Ibadan, Oyo 200273",3.87104392051697,7.35961723327637,6b0905e3-e860-47d7-b7ce-0d175689573f,8
Nice Touch Dry Cleaners,"Lateef Jakande Road, Lagos, Ogun",3.35414290428162,6.63062381744385,d1557d41-81f4-4074-aea7-8abb49dbfcd3,6
Biskayne Cleaners,"2 Lateef Jakande Road, Lagos, Lagos State",3.35347652435303,6.62707424163818,6f8e99cc-6bcf-4a57-9590-53f6ab63f8ac,7
Clean N Classy,"116 Lagos Street, Lagos, Lagos State",3.33182716369629,6.62334251403809,dda9863e-de40-498c-94d2-12187edc532e,9
EXCELLENTOUCH LAUNDRY AND DRY CLEANING,"1 Folagoro Street, Shomolu, Lagos",3.35971903800964,6.63711166381836,dc6fe935-210f-43f4-94e3-dca81437397a,9
Tunisky Integrated Drycleaners,"4, Ijewere Street off Odogbolu Street, via Adetola Street, Aguda, Surulere, Lagos,234, Lagos, Lagos",3.33421039581299,6.62350988388062,a5aa516c-ed48-4656-a14b-0cda84983e04,6
Magson Dry Cleaners,"Adeniyi Jones Avenue, Lagos, Ogun",3.34567403793335,6.61324882507324,9b4db989-78a9-45a3-99f7-2699a26df97d,4
KE-TE LAUNDRY AND DRY CLEANING SERVICES,"20, Oluwakemi Street, Alapere, Lagos, Ogun",3.33422994613647,6.62360000610352,3f136afc-6180-432d-a2a2-00b2a9af1c1d,9
Henry Sweet Laundry & Dry Cleaner,"38 Sijuwola St, Ilasamaja 102214, Lagos, Nigeria, Lagos, Lagos State",3.32783579826355,6.63369798660278,2bf3d166-50db-4320-9f9c-4ca61cc1d555,5
Astra Cleaners LTD,"Lagos NG, 82 Allen Ave, Allen, Ikeja 100001, Nigeria, Lagos, Lagos State",3.35246658325195,6.60051441192627,9405af9b-a311-4453-997b-5ea4ff29a442,3
Apostolos,"28 Ayo Alabi Street, Oke-Ira, Ogba, Lagos,100215, Lagos, Ogun",3.33421039581299,6.62350988388062,fd34de54-fb72-4d19-9c15-691c350aeec7,3
Emanet Professional Drycleaners,"15B Ojodu Abiodun road, Ojodu Berger, Lagos, Lagos, Lagos",3.37000036239624,6.65164995193481,9bea2dec-ba99-411e-904e-aa27f41e4e6d,10
Branetips Laundry,"Ibukun Oluwa Street, Lagos, Lagos State",3.33688735961914,6.64144515991211,3229d74a-3428-49e7-86b9-2eb1b0d33c1e,1
